character,dialog,episode,season
Sokka," Orchestra, huh? Well, la-di-da.",10,2
Sokka," This is great and all, but don't we have more important things to worry about? We should be making plans.",10,2
Toph,We  did  make plans. We're all picking mini-vacations.,10,2
Sokka,There's no time for vacations.,10,2
Aang,I'm learning the elements as fast as I can. I practice hard every day with Toph and Katara. I've been training my arrow off!,10,2
Katara," Yeah, what's wrong with having a little fun in our down time?",10,2
Sokka,"Even if you do master all of the elements, then what? It's not like we have a map of the Fire Nation.  Knock, knock. Hello, Fire Lord? Anybody home? I don't think so. We need some intelligence if we're going to win this war.",10,2
Katara,,10,2
Aang," Your turn, Katara. Where would you like to go on your mini-vacation?",10,2
Katara, How about the Misty Palms Oasis? That sounds refreshing.,10,2
Aang,"Oh, yeah, I've been there. It's a pristine natural ice spring. And I usually don't use the word ""pristine"".  It's one of nature's wonders.",10,2
Aang,Must've changed ownership since I was here. ,10,2
Zei," One mango, please.",10,2
Sokka,I don't see anything wrong with having one of those fruity beverages while we plan our strategy.  Excuse me.,10,2
Aang,"No worries, I clean up easy. ",10,2
Zei, You're a living relic.,10,2
Aang," Thanks, I try.",10,2
Zei,"An Air Nomad, right in front of me.  Tell me, which of the air temples do you hail from?",10,2
Aang,The Southern Temple.,10,2
Zei," Oh, splendid! Now tell me- what was the primary agricultural product of your people?",10,2
Aang," Uh, are fruit pies an agricultural product?",10,2
Zei,"Oh, truly fascinating. That is one for the journal. ",10,2
Sokka,"So Professor, you're obviously a well-traveled guy. Do you have a more current map? Ours seems to be a little dated.",10,2
Zei,Certainly.,10,2
Sokka,"What, no Fire Nation?  Doesn't anybody have a good map of that place?",10,2
Katara, You've made a lot of trips into the desert.,10,2
Zei,"All in vain, I'm afraid. I've found lost civilizations all over the Earth Kingdom, ",10,2
Toph, You spent years walking through the desert to find some guy's library?,10,2
Zei,"This library is more valuable than gold, little lady. It is said to contain a vast collection of knowledge, and knowledge is priceless.",10,2
Toph," Hmm, sounds like good times.",10,2
Zei,"Oh, it is. According to legend, it was built by the great Knowledge Spirit, Wan Shi Tong, with the help of his ""foxy"" knowledge seekers.",10,2
Sokka," Oh, so this spirit has attractive assistants, huh?",10,2
Katara," I think he means they look like actual foxes, Sokka.",10,2
Zei,"You're both right.  Wan Shi Tong and his knowledge seekers collected books from all over the world, and put them on display for mankind to read, so that we might better ourselves.",10,2
Sokka,"If this place has books from all over the world,  do you think they've got info on the Fire Nation? A map, maybe?",10,2
Zei,"I wouldn't know. But if such a thing exists, it's in Wan Shi Tong's Library.",10,2
Sokka,"Then it's settled. Aang, I do believe it's my turn. I'd like to spend my vacation ",10,2
Toph," Uh, hey, what about me? When do I get to pick?",10,2
Sokka,You gotta work here a little longer before you qualify for vacation time.,10,2
Toph,Hmph! ,10,2
Zei,"Of course, there's the matter of finding it. I've made several trips into the Si Wong Desert and almost died each time.  I'm afraid that desert's impossible to cross.",10,2
Sokka,"Professor, would you like to see our sky bison?",10,2
Zei,A sky bison?! You actually have one?,10,2
Zei," Sandbenders, shoo, away from the bison!",10,2
Zei,"Tell me, sky bison, are you the last of your breed?  Shush, chatty monkey.",10,2
Aang," Wow, shouldn't be too hard to find a place like this out here.",10,2
Toph, Does this place even exist?,10,2
Zei,Some say it doesn't.,10,2
Toph,,10,2
Toph,,10,2
Katara,"It shouldn't be this hard to spot a giant, ornate building from the air.",10,2
Sokka," Down there, what's that?",10,2
Katara, The building in this drawing is enormous.,10,2
Sokka, What kind of animal is that?,10,2
Zei,"I think that was one of the Knowledge Seekers.  Oh, we must be close to the library!",10,2
Sokka, It's completely buried.,10,2
Zei,,10,2
Toph, And it's huge.,10,2
Sokka,That fox thingy went in through a window. I say we climb up there and give it a look.,10,2
Toph,I say you guys go ahead without me.,10,2
Katara,You got something against libraries?,10,2
Toph,"I've held books before. And I gotta tell you, they don't exactly do it for me.",10,2
Katara," Oh, right. Sorry.",10,2
Toph,Let me know if they have something you can listen to.,10,2
Aang,,10,2
Toph, What's up?,10,2
Zei,"Oh, it's breathtaking!  What's funny?",10,2
Aang,Nothing. We just like architecture.,10,2
Zei, As do I.,10,2
Zei,"My word!  Eh, nice owl.",10,2
Wan Shi Tong, I know you're back there.,10,2
Zei," Hello, I'm Professor Zei, head of anthropology at Ba Sing Se University.",10,2
Wan Shi Tong,You should leave the way you came.  Unless you want to become a  stuffed  head of anthropology.,10,2
Sokka,Are you the spirit who brought this library to the physical world?,10,2
Wan Shi Tong,"Indeed, I am Wan Shi Tong, ""He Who Knows Ten Thousand Things."" And you are obviously humans, which, by the way, are no longer permitted in my study.",10,2
Aang,What do you have against humans?,10,2
Wan Shi Tong,Hm! Humans only bother learning things to get the edge on other humans.  who are you trying to destroy?,10,2
Sokka, What? No-no-no-no destroying. We're not into that.,10,2
Wan Shi Tong, Then why have you come here?,10,2
Sokka,Um ... knowledge for knowledge's sake?,10,2
Wan Shi Tong," If you're going to lie to an all-knowing spirit being, you should at least put some effort into it.",10,2
Sokka,"I'm not lying, I'm here with the Avatar, ",10,2
Aang,Ow. ,10,2
Wan Shi Tong,"Hmm, very well. I'll let you peruse my vast collection  To prove your worth as scholars, you have to contribute some worthwhile knowledge.",10,2
Zei, Please accept this tome as a donation to your library.,10,2
Wan Shi Tong,,10,2
Katara, I have an authentic waterbending scroll.,10,2
Wan Shi Tong,,10,2
Aang, Hah!,10,2
Wan Shi Tong,I suppose that counts. ,10,2
Sokka, It's a special knot. That counts as knowledge!,10,2
Wan Shi Tong,,10,2
Sokka, Bright enough to fool you.,10,2
Toph,,10,2
Aang," Hey, look at these weird lion turtle things.",10,2
Sokka," Eh, I've seen weirder.",10,2
Katara," Aang, did you know in a past life, you were left-handed?",10,2
Aang,I always knew I was special.,10,2
Sokka,,10,2
Aang," Sokka, where are you going?",10,2
Sokka, The information on the Fire Nation should be right up here.,10,2
Aang, Firebenders.,10,2
Katara,They destroyed everything having to do with the Fire Nation.,10,2
Sokka,"That's so unfair! Just when I think I'm one step ahead of the Fire Nation, it turns out they beat us here a long time ago.  Hello, little weird fox guy.",10,2
Zei,Seems it's trying to assist you.,10,2
Sokka,"Um, sure, I guess I'll follow you.",10,2
Zei,"This room is a true marvel, a mechanical wonder. It's a planetarium that shows the heavens moving.",10,2
Sokka,"Uh, this is beautiful, but how is it helpful?",10,2
Katara,"Maybe these dials represent dates and times. Sokka, try entering that date from that parchment you took.",10,2
Sokka," Shh, Katara, not in front of the fox, he's with the owl.",10,2
Aang,"Wow, I got to hand it to you, Sokka. You picked the best mini-vacation for sure.",10,2
Katara,"Hey, wait. What happened to the sun?",10,2
Aang," Great, you must have broken it.",10,2
Sokka, Sorry.,10,2
Katara,"That makes sense. I mean, think what the lunar eclipse at the North Pole did to the waterbenders. This is huge.",10,2
Sokka," We've gotta get this information to the Earth King at Ba Sing Se. We'll wait for the next eclipse, then we'll invade the Fire Nation when they're totally helpless. The Fire Lord is going down!",10,2
Wan Shi Tong," You betrayed my trust. From the beginning, you intended to misuse this knowledge for evil purposes.",10,2
Sokka,"You don't understand. If anyone's evil, it's the Fire Nation. You saw what they did to your library. They're destructive and dangerous. We need this information.",10,2
Wan Shi Tong,You think you're the first person to believe their war was justified? Countless others before you have come here seeking weapons or weaknesses or battle strategies.,10,2
Aang,"We had no choice. Please, we're just desperate to protect the people we love.",10,2
Wan Shi Tong,And now I'm going to protect what  I  love. ,10,2
Aang,What are you doing?,10,2
Wan Shi Tong,I'm taking my knowledge back. No one will ever abuse it again.,10,2
Katara, He's sinking the building. We've gotta get out of here.,10,2
Wan Shi Tong,I'm afraid I can't allow that. You already know too much. ,10,2
Toph,"I already  told  you, I don't wanna snuggle. ",10,2
Zei," Great Knowledge Spirit, I beg you, do not destroy your vast collection of priceless tomes.",10,2
Aang, We've gotta get back to the surface!,10,2
Katara,"Sokka, let's go.",10,2
Sokka,But we still don't know when the next eclipse is gonna to happen.,10,2
Katara,Don't be stupid! We'll find out later!,10,2
Sokka,"No, we won't. If we leave this place, we'll never get the information. Aang, come with me to the planetarium,  I need cover. Katara, take Momo and get out of here!",10,2
Katara,But ...!,10,2
Sokka,Go!,10,2
Katara,"Hurry, Sokka!",10,2
Toph,What is it now?,10,2
Toph, Who's there?,10,2
Aang,Why are we doing this?,10,2
Sokka,"Because if this calendar can tell us about eclipses in the past, then maybe it can project when the next one will be.",10,2
Aang,You can't possibly check every single date.,10,2
Sokka," I don't have to. We just need to check every date before Sozin's Comet arrives. Because after that- well, try not to think about that.",10,2
Aang," Come on, eclipse.",10,2
Sokka,"That's it! The solar eclipse! It's just a few months away.  Got it. Now, let's get to Ba Sing Se.",10,2
Toph,Don't make me put this down.,10,2
Toph,No! Stop sinking! ,10,2
Wan Shi Tong,At least I'll have one specimen to add to my collection.,10,2
Wan Shi Tong,"Your waterbending won't do you much good here.  I've studied Northern water style, Southern water style, even Foggy Swamp style.",10,2
Sokka,That's called Sokka style.  Learn it.,10,2
Sokka,"Wait! Professor, let's go.",10,2
Zei, I could spend an eternity in here.,10,2
Katara, Just go!,10,2
Sokka,We got it. There's a solar eclipse coming.  The Fire Nation's in trouble now!,10,2
Aang, Where's Appa?,10,2
Aang, How could you let them take Appa?!  Why didn't you stop them?!,11,2
Toph, I couldn't! The library was sinking! You guys were still inside and-,11,2
Aang, You could've come to get us. I could've saved him!,11,2
Toph, I can hardly feel any vibrations out here. The sandbenders snuck up on me and there wasn't time for ,11,2
Aang, You just didn't care! You never liked Appa! You wanted him gone!,11,2
Katara,"Aang, stop it. You know Toph did all she could. She saved our lives.",11,2
Sokka,Who's going to save our lives now? We'll never make it out of here.,11,2
Aang,"That's all any of you guys care about, yourselves! You don't care whether Appa is okay or not!",11,2
Katara,"We're all concerned, but we can't afford to be fighting now.",11,2
Aang, I'm going after Appa.,11,2
Katara,"Aang, wait!",11,2
Katara,We'd better start walking. We're the only people who know about the solar eclipse. We have to get that information to Ba Sing Se.,11,2
Sokka,"You think if we dig out the giant owl, he'll give us a ride?",11,2
Zuko,Maybe we should make camp.,11,2
Iroh,"No please, don't stop just for me!",11,2
Iroh, What now?,11,2
Iroh,Colonel Mongke! What a pleasant surprise!,11,2
Mongke,"If you're surprised we're here, then the Dragon of the West has lost a few steps.",11,2
Zuko, You know these guys?,11,2
Iroh,Sure. Colonel Mongke and the Rough Rhinos are legendary. Each one is a different kind of weapon specialist.  They are also a very capable singing group.,11,2
Mongke,We're not here to give a concert. We're here to apprehend fugitives!,11,2
Iroh," Would you like some tea first? I'd love some. How about you, Kahchi? I make you as a jasmine man. Am I right?",11,2
Mongke,Enough stalling! Round 'em up!,11,2
Iroh,It's nice to see old friends.,11,2
Zuko,Too bad you don't have any old friends that don't want to attack you.,11,2
Iroh, Hmmm ... Old friends that don't want to attack me ...,11,2
Sokka,,11,2
Toph,No.,11,2
Sokka,Right. Sorry.,11,2
Katara,"Come on guys, we've got to stick together.",11,2
Sokka,"If I sweat anymore, I don't think sticking together will be a problem.",11,2
Toph,"Katara, can I have some more water?",11,2
Katara,"Okay, but we've got to try to conserve it.",11,2
Sokka, You used this on the swamp guy! Urch!,11,2
Toph,It does taste swampy.,11,2
Katara," I'm sorry, it's all we have.",11,2
Sokka,Not anymore! Look!,11,2
Katara," Sokka, wait! You shouldn't be eating strange plants!",11,2
Sokka,There's water trapped inside these!,11,2
Katara, I don't know ...,11,2
Sokka, Suit yourself. It's very thirst quenching though.,11,2
Sokka, It's the quenchiest!,11,2
Katara,"Okay, I think you've had enough.",11,2
Sokka,Who lit Toph on fire?,11,2
Toph,Can I get some of that cactus?,11,2
Katara," I don't think that's a good idea. Come on, we need to find Aang.",11,2
Sokka, How did we get out here in the middle of the ocean?,11,2
Aang,Appa!  Appa!,11,2
Aang,No ...  No!,11,2
Katara,What is that?,11,2
Toph,What? What is what?,11,2
Sokka,It's a giant mushroom!  Maybe it's friendly!,11,2
Katara,Let's just keep moving. I hope Aang's okay ...,11,2
Sokka,Friendly mushroom! Mushy giant friend!,11,2
Man,"Yeah, a little barefoot blind girl and her friends passed through here a few days ago.",11,2
Yu,Did they give you any indication where they were headed?,11,2
Man,Maybe you could give me a little incentive?,11,2
Xin Fu,You suggesting I break your fingers?,11,2
Man,They went in the desert! Too bad there's almost no chance they survived.,11,2
Xin Fu,"That's okay, 'cause she's wanted dead or alive.",11,2
Yu,No she's not! I'm certain her father wants her alive.,11,2
Xin Fu,"Hey, look ... Fire Nation wanted posters!",11,2
Yu,So?,11,2
Xin Fu,"So, look who's here.",11,2
Katara,"I'm sorry, Aang. I know it's hard for you right now but ... we need to focus on getting out of here.",11,2
Aang, What's the difference? We won't survive without Appa. We all know it.,11,2
Katara," Come on, Aang. We can do this if we work together. Right Toph?",11,2
Toph,"As far as I can feel, we're trapped in a giant bowl of sand pudding. I got nothin'.",11,2
Katara, Sokka? Any ideas how to find Ba Sing Se?,11,2
Sokka, Why don't we ask the circle birds?,11,2
Katara," Ugh ... We're getting out of this desert, and we're going to do it together! Aang, get up. Everybody, hold hands. We can do this. We have to.",11,2
Katara,I think we should stop for the night.,11,2
Toph,Is there any more water?,11,2
Katara,This is the last of it. Everyone can have a little drink.,11,2
Sokka," Momo, no! You've killed us all!",11,2
Katara,"No, he hasn't.",11,2
Sokka," Oh, right. Bending.",11,2
Katara,"Sokka, let me see the things you got from the library.",11,2
Sokka, It was you! You ratted me out!,11,2
Katara,"Sokka, I was there.",11,2
Aang, It doesn't matter. None of those will tell us where Appa is.,11,2
Katara,"No, but we can find out which way Ba Sing Se is. We can use the stars to guide us.  That way we can travel at night when it's cool and rest during the day.",11,2
Katara,Just try to get some sleep. We'll start again in a few hours.,11,2
Zuko,No one here is going to help us. These people just look like filthy wanderers.,11,2
Iroh,"So do we.  Ah, this is interesting. I think I found our friend.",11,2
Zuko,You brought us here to gamble on Pai Sho?,11,2
Iroh,I don't think this is a gamble.,11,2
Xin Fu,Let's take them now!,11,2
Yu,"This place is full of desperate characters. If they find out we're collecting a bounty, we might have to fight them all just to keep our prize. Patience.",11,2
Iroh,May I have this game?,11,2
Fung,,11,2
Iroh,Those who do can always find a friend.,11,2
Fung,Then let us play.,11,2
Fung,"Welcome, brother. The White Lotus opens wide to those who know her secrets.",11,2
Zuko,What are you old gasbags talking about?,11,2
Iroh,I always tried to tell you that Pai Sho is more than just a game.,11,2
Xin Fu,I'm not waiting all night for these geezers to finish yapping!  It's over! You two fugitives are coming with me!,11,2
Fung, I knew it! You two are wanted criminals with a giant bounty on your heads!,11,2
Zuko,I thought you said he would help!,11,2
Iroh, He is. Just watch.,11,2
Fung, You think you're going to capture them and collect all that gold?,11,2
Man in the bar,Gold?,11,2
Yu,Uh ... Maybe we shouldn't.,11,2
Katara,"Come on, get up. We need to go.",11,2
Toph,Yesterday my mouth tasted like mud. Now it just tastes like sand. I never thought I'd miss the taste of mud so much.,11,2
Aang,I'm awake. I couldn't sleep.,11,2
Katara,"Well, we need to get moving if we want to get out of this sand pit.",11,2
Aang, Appa!,11,2
Sokka,Appa? But why would Princess Yue need him? She's the moon!  She flies by herself!,11,2
Katara," Here, fly up and bend the water from that cloud into my pouch.",11,2
Katara, Wow ... there's hardly any in here.,11,2
Aang, What are you doing?!,11,2
Katara,Trying to keep everyone together. Let's just get moving. We need to head this direction.,11,2
Toph,Ow! Crud! I am so sick of not feeling where I'm going!  And what idiot buried a boat in the middle of the desert?,11,2
Katara,A boat?,11,2
Toph,"Believe me, I kicked it hard enough to feel plenty of vibrations.",11,2
Katara,"It's one of the gliders the sandbenders use! And look! It's got some kind of compass on it!  I bet it can point us out of here! Aang, you can bend a breeze so we can sail it. We're going to make it!",11,2
Fung,"It is an honor to welcome such a high-ranking member of the Order of the White Lotus. Being a Grand Master, you must know so many secrets.",11,2
Zuko," Now that you played Pai Sho, are you going to do some flower arranging, or is someone in this club going to offer some real help?",11,2
Iroh,You must forgive my nephew. He is not an initiate and has little appreciation for the cryptic arts.,11,2
Florist,Who knocks at the garden gate?,11,2
Iroh,One who has eaten the fruit and tasted its mysteries.,11,2
Iroh,I'm afraid it's members only. Wait out here.,11,2
Katara,The needle on this compass doesn't seem to be pointing north according to my charts.,11,2
Sokka, Take it easy little lady. I'm sure the sand folks who built this baby know how to get around here.,11,2
Katara,That's what the compass is pointing to! That giant rock! It must be the magnetic center of the desert.,11,2
Toph, A rock?! Yes! Let's go!,11,2
Katara, Maybe we can find some water there!,11,2
Aang, Maybe we can find some sandbenders.,11,2
Toph,Ahhh ... Finally! Solid ground!,11,2
Sokka, I think my head is starting to clear out the cactus juice. And look!,11,2
Sokka,"Tastes like rotten penguin meat! Awww, I feel woozy.",11,2
Katara, You've been hallucinating on cactus juice all day and then you just lick something you find stuck to the wall of a cave?!,11,2
Sokka,I have a natural curiosity.,11,2
Toph,I don't think this is a normal cave. This was carved by something.,11,2
Aang,Yeah ... look at the shape.,11,2
Toph, Something that's coming for us!,11,2
Sokka, What are you doing? That rock almost crushed me!,11,2
Toph,"Sorry, I can't tell where they are in the air!",11,2
Sokka,I got this one.,11,2
Katara,"Sokka, there's nothing there!",11,2
Sokka,I guess my head's not as clear as I thought.,11,2
Katara,We have to get out of here! I'm completely out of water to bend!,11,2
Aang,Momo! I'm not losing anyone else out here.,11,2
Katara,"Come on, we're going down.",11,2
Katara,"Toph, shoot a rock right there. Fire!",11,2
Sokka,"Yeah! You got it! She got it, right?",11,2
Katara,Yes. Now let's move.,11,2
Katara,On your left!,11,2
Zuko,What's going on? Is the club meeting over?,11,2
Iroh,Everything is taken care of. We're heading to Ba Sing Se.,11,2
Zuko,Ba Sing Se? Why would we go to the Earth Kingdom capital?,11,2
Fung, The city is filled with refugees. No one will notice two more.,11,2
Iroh,We can hide in plain sight there. And it's the safest place in the world from the Fire Nation. Even I couldn't break through to the city. ,11,2
White Lotus member,"I have the passports for our guests, but there are two men out on the street looking for them.",11,2
Xin Fu,You seen these guys?,11,2
Sha-Mo,"What are you doing in our land with a sandbender sailer?  From the looks of it, you stole it from the Hami tribe.",11,2
Katara,We found the sailer abandoned in the desert. We're traveling with the Avatar.  Our bison was stolen and we have to get to Ba Sing Se.,11,2
Ghashiun,You dare accuse our people of theft while you ride in on a stolen sand sailer?!,11,2
Sha-Mo,"Quiet, Ghashiun. No one accused our people of anything. If what they say is true, we must give them hospitality.",11,2
Ghashiun,"Sorry, father.",11,2
Toph,I recognize the son's voice. He's the one that stole Appa.,11,2
Katara,Are you sure?,11,2
Toph,I never forget a voice.,11,2
Aang, You stole Appa! Where is he? What did you do to him?,11,2
Ghashiun,They're lying! They're the thieves!,11,2
Aang, Where is my bison?,11,2
Xin Fu,"Hey you, where are these men? I got a tip that they're in your shop.",11,2
Florist," As you can see, no one is here but us.",11,2
Yu,We know all about your secret back room.  Kick it down.,11,2
Florist,Hey! That room is for flowers only!,11,2
Yu,Some unlucky soul has an incomplete Pai Sho set.,11,2
Xin Fu,Let's go back to finding the girl.,11,2
Aang,You tell me where he is now!,11,2
Sha-Mo:, What did you do?,11,2
Ghashiun,I-It wasn't me!,11,2
Toph,You said to put a muzzle on him!,11,2
Aang, You muzzled Appa?,11,2
Ghashiun,I'm sorry! I didn't know that it belonged to the Avatar!,11,2
Aang, Tell me where Appa is!,11,2
Ghashiun, Please! We'll escort you out of the desert! We'll help however we can!,11,2
Sokka,Just get out of here! Run!,11,2
Katara,,12,2
Sokka," Sure, five thousand year-old maps from the spirit library. Just splash some water on 'em.",12,2
Katara,Sorry. ,12,2
Aang,"So, did you figure out what route we're going to take?",12,2
Sokka,"Okay, we just got out of the desert, so we must be around here. And we need to go to Ba Sing Se, which is here. It looks like the only passage connecting the south to the north is this sliver of land called the Serpent's Pass.",12,2
Toph,You sure that's the best way to go?,12,2
Sokka,"It's the only way. I mean, it's not like we have Appa to fly us there.",12,2
Katara, Shush up about Appa. Can't you at least try to be sensitive?,12,2
Aang,"Katara, it's okay. I know I was upset about losing Appa before, but I just want to focus on getting to Ba Sing Se and telling the Earth King about the solar eclipse.",12,2
Katara," Oh ... well, okay. I'm glad you're doing better.",12,2
Sokka,Then to Ba Sing Se we go. No more distractions.,12,2
Than,"Hello there, fellow refugees!",12,2
Aang,"So, you guys are headed to Ba Sing Se, too?",12,2
Than,Sure are. We're trying to get there before my wife Ying has her baby.,12,2
Katara,Great! We can travel through the Serpent's Pass together.,12,2
Ying,The Serpent's Pass? Only the truly desperate take that deadly route!,12,2
Toph,"Deadly route.  Great pick, Sokka!",12,2
Sokka,"Well, we are desperate.",12,2
Than,You should come with us to Full Moon Bay. Ferries take refugees across the lake. It's the fastest way to Ba Sing Se.,12,2
Ying,"And it's hidden, so the Fire Nation can't find it.",12,2
Katara,Hmm ... peaceful ferry ride or deadly pass?,12,2
Katara,I can't believe how many people's lives have been uprooted by the Fire Nation.,12,2
Than,"We're all looking for a better life, safe behind the walls of Ba Sing Se.",12,2
Iroh,"Who would have thought after all these years, I'd return to the scene of my greatest military disgrace ...  as a tourist!",12,2
Zuko,"Look around. We're not tourists, we're refugees.  Ugh! I'm sick of eating rotten food, sleeping in the dirt. I'm tired of living like this!",12,2
Jet,"Aren't we all? My name's Jet and these are my Freedom Fighters, Smellerbee and Longshot.",12,2
Smellerbee,Hey. ,12,2
Zuko,Hello.,12,2
Jet,"Here's the deal. I hear the captain's eating like a king while the refugees have to feed off his scraps. Doesn't seem fair, does it?",12,2
Iroh,What sort of king is he eating like?,12,2
Jet,"The fat, happy kind.  You want to help us ""liberate"" some food?",12,2
Zuko, I'm in.,12,2
Ticket lady,I told you already ... no vegetables on the ferry! One cabbage slug could destroy the entire ecosystem of Ba Sing Se! Security!,12,2
Cabbage merchant,Ahhh! My cabbages! ,12,2
Ticket lady,Next!,12,2
Aang,"Um, four tickets for the ferry to Ba Sing Se, please.",12,2
Ticket lady,Passports?,12,2
Aang,Uh ... no one told us we had to have passports.,12,2
Sokka,Don't you know who this is? He's the Avatar!,12,2
Ticket lady,"Ah, I see fifty Avatars a day and, by the way, not a very impressive costume.  Besides, no animals allowed. Do I need to call security?",12,2
Aang,That won't be necessary.,12,2
Ticket lady,Next!,12,2
Toph,"I'll take care of this. My name is Toph Beifong, and I'll need four tickets. ",12,2
Ticket lady,"Ah, the golden seal of the flying boar! It is my pleasure to help anyone of the Beifong family.",12,2
