character,dialog,episode,season
Sozin,"With Roku gone, and the great comet returning, the timing was perfect to change the world.  The Fire Nation's greatest threat ... the last airbender.",6,3
Zuko,That can't be it! Where's the rest of it? ,6,3
Zuko," You sent this, didn't you? I found the secret history, which by the way should be renamed history most people already know! The note said that I needed to know about my great-grandfather's death, but he was still alive in the end.",6,3
Iroh, No. He wasn't.,6,3
Zuko, What are you talking about?,6,3
Iroh,"You have more than one great-grandfather, Prince Zuko. Sozin was your father's grandfather.  Your mother's grandfather was Avatar Roku.",6,3
Zuko, Why are you telling me this?,6,3
Iroh,"Because understanding the struggle between your two great-grandfathers can help you better understand the battle within yourself.  What happened generations ago can be resolved now, by  you  . Because of your legacy, you alone can cleanse the sins of our family and the Fire Nation. Born in you, along with all the strife, is the power to restore  balance  to the world.",6,3
Iroh,This is a royal artifact. It's supposed to be worn  by the Crown Prince.,6,3
Katara,"You mean, after all Roku and Sozin went through together, even after Roku showed him mercy, Sozin betrayed him like that?",6,3
Toph, It's like these people are born bad.,6,3
Aang," No, that's wrong. I don't think that was the point of what Roku showed me at all.",6,3
Sokka, Then what  was  the point?,6,3
Aang, And I also think it was about friendships.,6,3
Toph, Do you really think friendships can last more than one lifetime?,6,3
Aang, I don't see why not.,6,3
Sokka,"Well, scientifically speaking, there's no way to prove that ...",6,3
Katara," Oh, Sokka, just hold hands.",6,3
Toph, How could you do this to me? You betrayed me!,7,3
Katara,,7,3
Aang,Okay. I'm ready for some training.,7,3
Toph,"Good job, Twinkle Toes. Visualize, then attack.",7,3
Katara,"Maybe you should take your own advice, Toph!",7,3
Toph,"What's the matter? Can't handle a little dirt, Madame Fussy-Britches?",7,3
Katara,"Oh, sorry. Did I splash you, Mud-Slug?",7,3
Aang,Are we taking a break?,7,3
Sokka, Sneak Attack!,7,3
Aang," Sokka, sneak attacks don't work if you yell it out loud.",7,3
Toph,Hungry for a mud pie? ,7,3
Katara, I'll give you a mud pie!,7,3
Aang,"Uh guys, I thought we were supposed to be training me.",7,3
Katara,,7,3
Toph,"While Katara cleans up,  let's go have some fun!",7,3
Aang,Yeah!,7,3
Sokka, Yes!,7,3
Sokka,"Look at all those messenger hawks! You know, I've been thinking about getting one for myself. That way, I wouldn't have to talk to anyone. I could just send them messages.",7,3
Toph,"I gotta say, I like the idea of not talking to you. ",7,3
Aang," So, guys. What are we gonna get with our last silver piece?",7,3
Toph,,7,3
Toph,This is where you seeing people are at a disadvantage. Everyone guesses wrong because the dealer moves the rock at the last minute. But I can feel it with my earthbending. ,7,3
Dealer, You there. Wanna play a friendly game?,7,3
Toph,How can I possibly play?  I'm blind.,7,3
Dealer,You don't have to see to be lucky.,7,3
Aang,"Flamey-O, Toph.",7,3
Dealer,Wow. Fancy guessing. You are amazing at this.  Would you like to make the game a little more interesting?,7,3
Toph, More interesting? How?,7,3
Dealer," then I'll put up twenty silver pieces against it, and that's more interesting.",7,3
Toph,,7,3
Dealer,Forty silver pieces it is. ,7,3
Dealer,,7,3
Toph,I won! ,7,3
Katara,Where did you guys get the money to buy all this stuff?,7,3
Aang,Toph got us money. ,7,3
Sokka, She used earthbending to win the game! Classic!,7,3
Katara,"Ah, so she cheated.",7,3
Toph, What's wrong with that?,7,3
Katara,I'm just saying this isn't something we should make a habit of doing.,7,3
Toph,Why? Because it's fun? And you hate fun?,7,3
Katara,I don't hate fun! ,7,3
Aang, I'll personally make you an Avatar Promise that we won't make a habit of doing these scams.,7,3
Katara,"Guys, I think these scams have gone far enough. If you keep doing them, something bad is gonna happen.",7,3
Toph,Could you for once stop being such a sourpuss and just lighten up? ,7,3
Katara,,7,3
Toph,Yeah! Maybe! Maybe then you'd see We're traveling around the world! Making easy money! Having fun! With no parents to tell us what to do!,7,3
Katara,Ah. I see. You're acting like this because of your parents.,7,3
Toph,Whatever.,7,3
Katara,"They were controlling over you, so you ran away, and now you act like your parents don't exist. You act like you hate them, but you don't. You just feel guilty.",7,3
Toph,I  do  hate them.,7,3
Katara,"I don't think so. I think you miss them, but you just don't wanna deal with that, so instead you act like this crazy person.",7,3
Toph," Look, I ran away to help Aang!",7,3
Katara,"You know what? It doesn't matter. These scams put us all at risk, and we don't need that.  We've already got some third-eyed freak after us.",7,3
Sokka,"Speaking of that ""third-eyed freak"", I think I've come up with a name for him. What do you think of ""Sparky-Sparky-Boom Man""?  Just think about it.",7,3
Katara, We have enough money! You need to stop this!,7,3
Toph,,7,3
Sokka,,7,3
Sokka,"Hawky, welcome to Team Avatar. My name's Sokka, and I'm your new owner, and as such I should warn you that there's already a lemur in our group, so I don't wanna see any fighting. ",7,3
Sokka,"Toph, while I was in town, I found something that you're not gonna like. ",7,3
Toph,"Well it sounds like a sheet of paper, but I guess you're referring to what's on the sheet of paper.",7,3
Sokka,It's a wanted poster. Of you. They've nicknamed you the Runaway.,7,3
Toph," A wanted poster! That's so great! ""The Runaway."" I love my new nickname. Is there a picture of me? Does it look good?",7,3
Sokka," But, Toph, you're missing the point. Maybe Katara was right. These scams are drawing too much attention to us.",7,3
Toph,Don't be such a worrywart like your sister. ,7,3
Sokka,,7,3
Toph, Make it an atlas.,7,3
Sokka, I do like expensive atlases.,7,3
Toph,Of course you do. ,7,3
Katara,"Sokka,  tell me you didn't buy a bird.",7,3
Sokka,"Not just a bird, a messenger bird. Now we can send messages all over the world. Even to Gran Gran.",7,3
Aang," Wow, how does it work?",7,3
Sokka,"Hm. Uh, I never actually thought about that. Hawky,  I think he gets it.",7,3
Sokka,Hawky! Make nice! Bad Hawky!,7,3
Katara, Where have you two been? Off scamming again?,7,3
Toph,"Yes, we were. ",7,3
Katara, And I suppose you don't think what you're doing is dangerous at all?,7,3
Toph,"No, I don't.",7,3
Katara,Really?,7,3
Toph,Yes. Really.,7,3
Katara,,7,3
Toph,,7,3
Katara,"It's a wanted poster of you! ""The Runaway!"" Is that what you're called now? Are you proud of this?",7,3
Toph, Where did you get that!?,7,3
Katara,It doesn't matter where I got it. The fact is-,7,3
Toph,You went through my stuff! You had no right!,7,3
Katara,"Your stuff was messy and I was just straightening up, and I happened to stumble across it!",7,3
Toph,"That's a lie!  You're lying, Katara!",7,3
Katara, Don't you walk away from me while I'm talking to you!,7,3
Toph," Oh really, Mom? Or what are you gonna do? Send me to my room?",7,3
Katara,I wish I could!,7,3
Toph,"Well you can't! Because you're not my mom, and you're not their mom! ",7,3
Katara,I never said I was!,7,3
Toph,"No, but you certainly act like it! You think it's your job to boss everyone around, but it's not! You're just a regular kid like the rest of us! So stop acting like you can tell me what to do! I can do whatever I want!",7,3
Katara,"I don't act that way!  Sokka, do I act motherly?",7,3
Sokka, Hey. I'm staying out of this one.,7,3
Katara," What do you think, Aang? Do I act like a mom?",7,3
Aang," Well. I, uh-",7,3
Katara, Stop rubbing your eye and speak clearly when you talk!,7,3
Aang," Yes, ma'am.",7,3
Toph,I can't be around you right now!,7,3
Katara,"Well, I can't be around you!",7,3
Sokka," I know, Hawky. Why can't they just get along?",7,3
Sokka,"Hey, Aang. You wanna test out my messenger hawk with me? I've got an idea.",7,3
Aang,Sure. ,7,3
Sokka," I'm going to send a note to Katara and say it's from Toph, who wants to apologize. Then everyone will be friends again.",7,3
Aang,"I gotta say, Sokka, you continue to impress me with your ideas.",7,3
Sokka,"It's a gift.  ""Dear Katara, sorry for everything. Your friend, Toph.""",7,3
Katara,"I know this is from you, Sokka! Toph can't write! ",7,3
Aang,I can't believe we forgot Toph can't write.,7,3
Sokka,Yup. We're idiots. ,7,3
Aang,I guess Plan B is we send a note to Toph pretending it's from Katara.,7,3
Sokka,I think we're gonna run into a similar problem.  Come on. We need to talk.,7,3
Toph,So lemme guess: You brought me out here to tell me that your sister's not as annoying as I make her out to be.,7,3
Sokka,"Nah, she's pretty much a pain.  She's always got to be right about everything and she gets all bossy and involved and in your business ...",7,3
Toph,Yeah. I don't know how you could deal with it.,7,3
Sokka,"Actually, in a way, I rely on it. ",7,3
Toph,I don't understand.,7,3
Sokka,"When our mom died, that was the hardest time in my life. Our family was a mess, but Katara? She had so much strength. She stepped up and took on so much responsibility. She helped fill the void that was left by our mom.",7,3
Toph,I guess I never thought about that.,7,3
Sokka,"I'm gonna tell you something crazy. I never told anyone this before, but honestly? I'm not sure I can remember what my mother looked like. It really seems like my whole life, Katara's been the one looking out for me. She's always been the one that's there. And now, when I try to remember my mom, Katara's is the only face I can picture. ",7,3
Toph,"The truth is sometimes Katara does act motherly, but that's not always a bad thing. She's compassionate and kind, and she actually cares about me.  Don't ever tell her I said any of this!",7,3
Sokka,"Hey, my lips are sealed.",7,3
Katara,"Hi, Toph. Um, I wanna-",7,3
Toph," Katara, stop. You don't need to apologize. I was the one being stupid. These scams are out of control, and I'm done with them.",7,3
Katara,,7,3
Toph, What?  You  wanna pull a scam?,7,3
Katara,"Not just any scam. The  ultimate  scam.  Whaddaya say, Toph? Just me and you. One last go. You in?",7,3
Toph,,7,3
Katara,"The plan is simple: This wanted poster says you're worth a lot of money; Ten times more than you've made in all of your scams. So I'm gonna turn you in and collect the reward. Then you metalbend yourself out of jail, and we're on our way. ",7,3
Toph, How could you do this to me? You betrayed me!,7,3
Katara,,7,3
Town authority,You did the right thing by turning in the Runaway.,7,3
Katara,The right thing is its own reward.,7,3
Town authority,"Well, I'm happy to hear you say that.",7,3
Katara," But, I still want the actual reward.",7,3
Town authority,Of course. Right this way.,7,3
Toph,Hey! What kind of cell is this?,7,3
Female guard,A wooden one. ,7,3
Town authority,That's her! That's the girl you were looking for!,7,3
Aang,Do you think this scam of theirs should be taking this long?,7,3
Sokka,I was just wondering the same thing. We'd better check it out. ,7,3
Toph,Wait! It's a trap!,7,3
Katara," Really? No kidding! Is that why we're sitting in a wooden cage right now? Gee, how'd you figure out it was a trap?",7,3
Toph,"Not for us, Katara! We're the bait! He wants Aang! ",7,3
Katara,I can't believe I'm so stupid! See? This is exactly why I'm against these scams! I knew this would happen!,7,3
Toph,"But, this was  your  idea.",7,3
Katara,I know. I wanted to show that I'm not so motherly. I wanted to show you that I can have fun too.,7,3
Toph,"Katara, you are fun. If nothing else, you're at least fun to argue with.",7,3
Katara,I know your relationship with your parents is complicated. And I shouldn't have said what I said.,7,3
Toph,"It's okay. I was really mad when you said that because ... well because, maybe it's true.  I try not to think about it, but when I left, I probably really hurt them.",7,3
Sokka,Where do you think they might be?,7,3
Aang,Where do you think anyone is?  It's Sparky-Sparky-Boom Man!,7,3
Sokka,"You know, I'm starting to think that name doesn't quite fit.",7,3
Katara,What are we gonna do?,7,3
Toph,I don't know. I wish we had some earth or water. We need bendables.,7,3
Katara,What about your meteor bracelet? You can make a saw.,7,3
Toph,I left it back at camp.  I was worried they would take it.,7,3
Toph," Um, Katara? Are you okay?",7,3
Katara,Just fine.,7,3
Toph," Well, what are you doing?",7,3
Katara,I'm making my own water.,7,3
Toph," Katara! You're a genius! A sweaty, stinky genius!",7,3
Sokka,This guy is too good! He shoots fire from his brain!,7,3
Aang,We should split up. He can't chase us both.,7,3
Katara,"Aang, get up! ",7,3
Toph,Let's get out of here!,7,3
Sokka," Hey, I got it! The perfect name for that guy: ""Combustion Man!""",7,3
Toph,"Good job, Sokka. Now let's get outta here before Combustion Man catches us.",7,3
Sokka,See? It fits so well!,7,3
Sokka, Yeah. You're such a lazy little bird.,7,3
Toph,Katara? I need your help.,7,3
Katara," What is it, Toph?",7,3
Toph, I need you to write some things down for me. I wanna send a letter to my parents.,7,3
Katara, I'll be happy to help.,7,3
Sokka,"Hey, where'd Hawky go?",7,3
Avatar Roku, Previously on Avatar ...,8,3
Katara,You're looking at the only waterbender in the whole South Pole. This ship has haunted my tribe when Gran-Gran was a little girl. It was part of the Fire Nation's first attacks.,8,3
Yue,"The legend said the moon was the first waterbender. Our ancestor saw how it pushed and pulled the tides, and learned how to do it themselves.",8,3
Katara,I always noticed my waterbending is stronger at night.,8,3
Toph,What are you doing?,8,3
Katara,I'm making my own water!,8,3
Sokka, Ooh-aaah!,8,3
Aang," I think I like ""the man with a sword for a hand"" better.",8,3
Toph,Water Tribe slumber parties must stink.,8,3
Katara,"No, wait! I've got one! And this is a true Southern Water Tribe story.",8,3
Sokka," Is this one of those ""a friend of my cousin knew some guy that this happened to"" stories?",8,3
Katara,"No, it happened to Mom.",8,3
Katara,"One winter when Mom was a girl, a snowstorm buried the whole village for weeks. A month later, Mom noticed she hadn't seen her friend Nini since the storm. So Mom and some others went to check on Nini's family. When they got there, no one was home.  Mom turned and saw Nini standing by the fire. She was blue like she was frozen. Mom ran outside for help, but when everyone came back, Nini was gone.",8,3
Sokka, Where'd she go?,8,3
Katara,"No one knows. Nini's house stands empty to this day, but sometimes, people see smoke coming up from the chimney, like little Nini is still trying to get warm.",8,3
Toph, I hear people under the mountain. And they're screaming.,8,3
Sokka,Pfft! Nice try.,8,3
Toph," No, I'm serious. I hear something.",8,3
Katara,You're probably just jumpy from the ghost stories ...,8,3
Toph,It just ... stopped.,8,3
Aang," All right, now I'm getting scared.",8,3
Hama," Hello, children.",8,3
Hama,Sorry to frighten you. My name is Hama.  I have an inn nearby. Why don't you come back there for some spiced tea and warm beds?,8,3
Sokka," Yes, please.",8,3
Katara,Thanks for letting us stay here tonight. You have a lovely inn.,8,3
Hama, You know you should be careful. People have been disappearing in those woods you were camping in.,8,3
Sokka,"What do you mean ""disappearing""?",8,3
Hama, Who wants more tea?,8,3
Hama,"Don't worry, you'll all be completely safe here.  Why don't I show you to your rooms and you can get a good night's rest?",8,3
Sokka,"I know, Momo.  I don't know if I'm gonna be able to fall asleep!",8,3
Hama, Time to go shopping!,8,3
Katara,That Mr. Yao seems to have a thing for you. Maybe we should go back and see if he'll give us some free komodo sausages?,8,3
Hama, I think you and I are going to get along swimmingly!,8,3
Villager,You won't have any ash bananas till next week?,8,3
Shop owner,"Well, I have to send the boy to Hing Wa Island to get them, and it's a two-day trip.",8,3
Villager,"Oh, right. Tomorrow's the full moon.",8,3
Shop owner, Exactly. I can't lose  another  delivery boy in the woods.,8,3
Sokka,"People disappearing in the woods, weird stuff happening during full moons? This just reeks of Spirit World shenanigans.",8,3
Aang,"I bet if we take a little walk around town, we'll find out what these people did to the environment to make the spirits mad.",8,3
Sokka," And then you can sew up this little mystery lickety-split, Avatar style!",8,3
Aang, Helping people ... that's what I do.,8,3
Hama,Why don't you take all those things back to the inn? I just have to run a couple more errands. I'll be back in a little while.,8,3
Sokka, This is a mysterious little town you have here.,8,3
Hama, Mysterious town for mysterious children.,8,3
Sokka,"That Hama seems a little strange. Like she knows something, or she's hiding something.",8,3
Katara, She kinda reminds me of Gran-Gran.,8,3
Sokka,"But what did she mean by that comment, ""mysterious children""?",8,3
Katara,"Gee, I don't know. Maybe because she found four strange kids camping in the woods at night? Isn't that a little mysterious?",8,3
Sokka,I'm gonna take a look around. ,8,3
Katara, You can't just snoop around someone's house.,8,3
Sokka,It'll be fine.,8,3
Aang, She could be home any minute.,8,3
Katara," Sokka, you're gonna get us all in trouble and this is just plain rude!",8,3
Sokka, Come on ...,8,3
Aang,"Okay, that's pretty creepy.",8,3
Katara, Hama will be back soon.,8,3
Sokka,"Just an ordinary puppet-loving innkeeper, huh? Well then why does she have a locked door up here?",8,3
Katara, Probably to keep people like you from snooping through her stuff!,8,3
Sokka,"We'll see.  It's empty, except for a little chest.",8,3
Toph,Maybe it's treasure!,8,3
Katara," Sokka, what are you doing? You're breaking into a private room!",8,3
Sokka,I have to see what's in there.,8,3
Aang,We shouldn't be doing this.,8,3
Sokka,Maybe there's a key here somewhere ...,8,3
Toph,Ooh! Hand it over!,8,3
Sokka," Come on, come on!",8,3
Toph, This isn't as easy as it looks!,8,3
Aang," Guys, I don't know about this ...",8,3
Katara,This is crazy! I'm leaving!,8,3
Sokka,"Suit yourself! Do it, Toph!",8,3
Hama, I'll tell you what's in the box.,8,3
Sokka, An old comb?,8,3
Hama,It's my greatest treasure. It's the last thing I own from growing up in the Southern Water Tribe.,8,3
Katara, You're from the Southern Water Tribe?,8,3
Hama, Just like you.,8,3
Katara,How did you know?,8,3
Hama,I heard you talking around your campfire.,8,3
Sokka,But why didn't you tell us?,8,3
Hama,"I wanted to surprise you! I bought all this food today so I could fix you a big Water Tribe dinner. Of course, I can't get all the ingredients I need here, but ocean kumquats are a lot like sea prunes if you stew them long enough.",8,3
Aang, Great ...,8,3
Katara,I knew I felt a bond with you right away.,8,3
Sokka,"And I knew you were keeping a secret, so I guess we're both right.  But I'm sorry we were sneaking around.",8,3
Hama,"Apology accepted.  Now, let's get cooking!",8,3
Aang, I'd steer clear of the sea prunes.,8,3
Toph,I thought they were ocean kumquats.,8,3
Aang,Close enough.,8,3
Hama,Who wants five flavor soup?,8,3
Katara, I've never met another waterbender from our tribe!,8,3
Hama, That's because the Fire Nation wiped them all out. I was the last one ...,8,3
Sokka,So how did you end up out here?,8,3
Hama, I was stolen from my home.,8,3
Hama, It was over sixty years ago when the raids started.,8,3
Hama," They came again and again, each time rounding up more of our waterbenders and taking them captive.",8,3
Hama," We did our best to hold them off, but our numbers dwindled as the raids continued.",8,3
Hama," Finally, I too was captured.",8,3
Hama, I was led away in chains. The last waterbender of the Southern Water Tribe.,8,3
Hama,They put us in terrible prisons here in the Fire Nation. I was the only one who managed to escape.,8,3
Sokka,How did you get away? And why did you stay in the Fire Nation?,8,3
Hama,I'm sorry. It's too painful to talk about anymore.,8,3
Katara,We completely understand. We lost our mother in a raid.,8,3
Hama," Oh, you poor things.",8,3
Katara,I can't tell you what it means to meet you. It's an honor. You're a hero.,8,3
Hama,I never thought I'd meet another Southern waterbender. I'd like to teach you what I know so you can carry on the Southern tradition when I'm gone.,8,3
Katara,"Yes! Yes, of course! To learn about my heritage, it would mean everything to me.",8,3
Hama,"Growing up in the South Pole, waterbenders are totally at home surrounded by snow and ice and seas. But as you probably noticed on your travels, that isn't the case wherever you go.",8,3
Katara,"I know! When we were stranded in the desert, I felt like there was almost nothing I could do.",8,3
Hama, That's why you have to learn to control water wherever it exists.,8,3
Katara,I've even used my own sweat for waterbending.,8,3
Hama," That's very resourceful, Katara. You're thinking like a true master. But did you know you could even pull water out of thin air?",8,3
Hama,"You have got to keep an open mind, Katara.  There's water in places you never think about.",8,3
Aang,This has got to be the nicest natural setting in the Fire Nation. I don't see anything that would make a spirit mad around here.,8,3
Toph,Maybe the Moon Spirit just turned mean.,8,3
Sokka," The Moon Spirit is a gentle, loving lady. She rules the sky with compassion and ... lunar goodness!",8,3
Aang," Excuse me, sir. Can you tell us anything about the spirit that's been stealing people?",8,3
Villager,Only one man ever saw it and lived and that's Old Man Ding.,8,3
Toph,Where does Old Man Ding live?,8,3
Katara,"Wow, these flowers are beautiful.",8,3
Hama,"They're called fire lilies. They only bloom a few weeks a year, but they're one of my favorite things about living here. And like all plants and all living things, they're filled with water.",8,3
Katara,I met a waterbender who lived in a swamp and could control the vines by bending the water inside.,8,3
Hama,You can take it even further.,8,3
Katara,"That was incredible!  It's a shame about the lilies, though.",8,3
Hama,"They're just flowers. When you're a waterbender in a strange land, you do what you must to survive. Tonight I'll teach you the ultimate technique of waterbending. It can only be done during the full moon, when your bending is at its peak.",8,3
Katara, But isn't that dangerous? I thought people have been disappearing around here during the full moon.,8,3
Hama,"Oh, Katara. Two master waterbenders beneath a full moon?  I don't think we have anything to worry about.",8,3
Aang,Old Man Ding?,8,3
Ding,"Huh?  Well, I'm young at heart.",8,3
Ding,Not ready to get snapped up by some moon monster yet at least.,8,3
Sokka, We wanted to ask you about that.,8,3
Aang,Did you get a good look at the spirit that took you?,8,3
Ding,"Didn't see no spirit, just felt something come over me, like I was possessed. Forced me to start walking toward the mountain.  But then the sun started to rise and I got control of myself again! I just high-tailed it away from that mountain as quick as I could!",8,3
Sokka,Why would a spirit want to take people to a mountain?,8,3
Toph,Oh no!  I did hear people screaming under the mountain. The missing villagers must still be there!,8,3
Toph, I can hear them. They're this way!,8,3
Hama,Can you feel the power the full moon brings?,8,3
Hama,"For generations it has blessed waterbenders with its glow, allowing us to do incredible things!",8,3
Hama, I've never felt more alive.,8,3
Toph,This is the place.,8,3
Sokka,I can't see anything down there.,8,3
Toph, That's why you have me. Let's go!,8,3
Male prisoner #1,We're saved!,8,3
Aang,I didn't know spirits made prisons like this. Who brought you here?,8,3
Female prisoner,It was no spirit.,8,3
Male prisoner #2,It was a witch!,8,3
Sokka,A witch? What do you mean?,8,3
Female prisoner," She seems like a normal old woman, but she controls people like some dark puppetmaster!",8,3
Sokka, Hama!,8,3
Male prisoner #1,"Yes, the innkeeper!",8,3
Sokka,I knew there was something creepy about her!,8,3
Aang,We have to stop Hama!,8,3
Toph,I'll get these people out of here. You go!,8,3
Hama,"What I'm about to show you,  I discovered in that wretched Fire Nation prison.",8,3
Hama," Once I had mastered the rats, I was ready for the men.",8,3
Hama, anyone.,8,3
Katara, I don't know if I want that kind of power.,8,3
Hama," Katara, they tried to wipe us out, our entire culture, your mother!",8,3
Katara, I know.,8,3
Hama," We have to fight these people whenever we can, wherever they are, with any means necessary!",8,3
Katara, You're the one who's been making people disappear during the full moons!,8,3
Hama," They threw me in prison to rot, along with my brothers and sisters! They deserve the same! You must carry on my work!",8,3
Katara,,8,3
Hama," It's impossible to fight your way out of my grip! I control every muscle, every vein in your body!",8,3
Katara, Stop! Please ...,8,3
Katara," My bending is more powerful than yours, Hama. Your technique is useless on me!",8,3
Hama, Aahhh!,8,3
Sokka,"We know what you've been doing, Hama!",8,3
Aang,Give up!  You're outnumbered!,8,3
Hama,No!  You've outnumbered yourselves.,8,3
Sokka," It's like my brain has a mind of its own! Stop it arm, stop it!",8,3
Aang,This feels weird!,8,3
Katara," I'm sorry, Aang!",8,3
Aang,It's okay!,8,3
