character,dialog,episode,season
Bato,"Your dad wore the octopus,  but I did the spooky voice.",15,1
Zuko," Step aside, filth!",15,1
Iroh, He means no offense! I'm certain you bathe regularly!,15,1
Zuko,I need to talk to you!,15,1
June,"Well, if it isn't my new friends: Angry Boy and Uncle Lazy.",15,1
Zuko,Your beast trashed my ship. You  have  to pay me back!,15,1
June,,15,1
Zuko,Money isn't what I had in mind.,15,1
Zuko,I need you to find someone. ,15,1
June," What happened, your girlfriend run off on you?",15,1
Zuko,"It's not the girl I'm after, it's the bald monk she's traveling with.",15,1
June, Whatever you say.,15,1
Zuko,"If you find them, I'll consider the damage to my ship  paid for  .",15,1
June,,15,1
Iroh,"Plus, we'll pay your weight in  gold  .",15,1
June," weight, and we gotta deal.",15,1
Iroh, You got it!,15,1
June, Get on!,15,1
Bato,There's something I should tell you kids. I'm expecting a message from your father. ,15,1
Katara, Really?,15,1
Sokka, When?,15,1
Bato,"Any day now. Your father said he'd send a message when they found the rendezvous point. If you wait until the message arrives, you can come with me, and see your father again.",15,1
Sokka,It's been over two years since we've seen Dad. That would be so incredible! Katara!,15,1
Katara,"I do really miss him, it would be  great  to see Dad. ",15,1
Bato,"It's been far too long, hasn't it?  I'm not sure when word will arrive, but when it does-",15,1
Sokka,"It would be great, but we can't. We have to take Aang to the North Pole first.",15,1
Katara,"Even if we do have time to wait for the message, who knows how far we'd have to travel. We don't have time for a long detour.",15,1
Bato,"I'm sure your father would understand, and be proud that his children are helping the Avatar.",15,1
Aang,I can't believe they would leave me.,15,1
Messenger,I'm looking for Bato of the Water Tribe.,15,1
Aang,"Uhhh, I know Bato!",15,1
Messenger,Make sure he gets this! ,15,1
Aang,It's the map to Sokka and Katara's dad!,15,1
Aang,Hey everyone! Sorry I was gone so long.,15,1
Katara," Hey, Aang, I didn't notice you left.",15,1
Aang,"Yup, but now I'm back.  Sure could go for some delicious sea prunes!",15,1
Herbalist,"Out for a bit of fresh air, are we?",15,1
Zuko,We're looking for someone.,15,1
Herbalist,I hope it's not Miyuki ,15,1
June,The Avatar's been through here. Let's keep moving.,15,1
Mother Superior,Aha! I caught you.  You should be ashamed of yourself ... Littering in the courtyard.,15,1
Aang,,15,1
Bato,This ship is sentimental to me. It was built by my father.,15,1
Sokka, Is this the boat he took you ice dodging in?,15,1
Bato,Yep! It's got the scar to prove it. Ha. How 'bout you Sokka? You must have some good stories from your first time ice dodging. ,15,1
Katara,He never got to go. Dad left before he was old enough.,15,1
Bato,"Oh, I forgot you were too young.",15,1
Aang,What's ice dodging?,15,1
Bato,"It's a rite of passage for young Water Tribe members. When you turn fourteen, your dad takes you-  You know what, you're about to find out!",15,1
Zuko, Why are we stopping?,15,1
June,Because the girl must have spent a lot of time here.,15,1
Zuko,We have no time for this!,15,1
Zuko,Hey! Watch it!,15,1
June," Oh look, he likes you!",15,1
Aunt Wu,"Care to hear your fortune, handsome?",15,1
Iroh,"At my age, there's really only one big surprise left, and I'd just as soon leave it a mystery.",15,1
Bato,"Ice dodging is a ceremonial test of wisdom, bravery, and trust.  In our village, ice dodging was done by weaving a boat through a field of icebergs.",15,1
Sokka,How are we supposed to ice dodge without ice?,15,1
Bato,"You'll be dodging those.  The winds can be brutal, so be brave. Aang, you control the jib. Without your steady hand, we all go down. Your position is about trust.",15,1
Aang,,15,1
Bato,"For this is to be done right, I cannot help.  You pass or fail on your own.",15,1
Sokka," Aang, helm to lee. Helm to lee!",15,1
Aang,What does that even mean?,15,1
Sokka,Great job!,15,1
Katara,There's no way through!,15,1
Sokka,We can make it.,15,1
Bato," Sokka, you've already proven yourself. Maybe we should-",15,1
Sokka,"Aang, I'm gonna need air in that sail.  Katara, I want you to bend as much water as you can between us and those rocks. Now!",15,1
Bato," And for Aang, the Mark of the Trusted. You are now an honorary member of the Water Tribe.",15,1
Aang,I can't. ,15,1
Katara,Of course you can!,15,1
Aang," No, you can't trust me.",15,1
Katara," Aang, what are you talking about?",15,1
Aang, You  have  to understand. I was afraid you would-,15,1
Sokka,,15,1
Bato,"Well, Sokka. I think you should-",15,1
Sokka," Katara, are you with me?",15,1
Katara, I'm with you Sokka.,15,1
Katara,Good luck.,15,1
Aang,Okay. You too.,15,1
Aang,Guess I should be moving on.,15,1
Mother Superior,That would be best.,15,1
Aang,"I'm an idiot, Momo. ",15,1
June,We're getting close. ,15,1
Katara, That wolf sounds so sad.,15,1
Sokka,It's probably wounded.,15,1
Bato, and being apart from them was more painful than my wounds.,15,1
Katara,Sokka?,15,1
Sokka,"We need to go back. I wanna see Dad, but, helping Aang is where we're needed the most.",15,1
Katara, You're right.,15,1
Bato," Your father will understand, and I know he's proud of you.",15,1
Sokka,"Thanks, Bato.",15,1
Bato,I know where to go from here.  Take this in case you want to find us. I'll leave a message at the rendezvous point.,15,1
Aang,"Looks like we're going alone, guys.",15,1
Mother Superior," Avatar, you must leave!",15,1
Aang," Okay, I get it. Everybody wants me gone.",15,1
Mother Superior,A group of people came to the abbey looking for you.,15,1
Aang,Who?,15,1
Mother Superior,"A fierce looking woman with a horrible monster, and a young man with a scar.",15,1
Aang,Zuko.,15,1
Mother Superior,The beast was using the scent of a necklace to follow you.,15,1
Aang,A necklace?  Katara!,15,1
June," No wonder she left, she's way too pretty for you.",15,1
Zuko, Where is he? Where is the Avatar?,15,1
Sokka,We split up. He's long gone.,15,1
Zuko,How stupid do you think I am?,15,1
Sokka,Pretty stupid.  Run!,15,1
Zuko,What are we supposed to do now?,15,1
June, It's seeking a different scent. Perhaps something that the Avatar held.,15,1
Zuko,What's it doing? It's just going in a circle.,15,1
Katara, Aang!,15,1
June,Up! ,15,1
June, Come on! Get up!,15,1
Sokka,I'm ... starting to get some feeling back!  Ow.,15,1
Aang,You've got something I want.,15,1
Sokka,That thing sees with its nose. Let's give him something to look at.,15,1
Mother Superior,The perfume?,15,1
Iroh,,15,1
Zuko,Uncle? I didn't see you get hit with the tongue.,15,1
Iroh,Shhh.,15,1
Aang,So ... where do we go?,15,1
Katara,We're getting  you  to the North Pole.,15,1
Sokka,"Yeah, we've lost too much time as it is.",15,1
Aang, Don't you want to see your father?,15,1
Sokka,"Of course we do, Aang. But, you're our family, too. And right now, you need us more.",15,1
Katara,And  we  need you.,15,1
Aang,"I wish I could give you a little piece of home, Katara. Something to remind you ...",15,1
Katara,I'll be okay.,15,1
Aang,"Still, just a little trinket. Maybe something like ... ",15,1
Katara," Aang, how'd you get that?",15,1
Aang,Zuko asked me to be  sure  I got it to you.,15,1
Katara,"Aw, that's so sweet of Zuko. Could you give him a kiss for me when you see him?",15,1
Aang,Sure.,15,1
Katara,"So, how long do you think it's been since someone was here?",15,1
Sokka,Long enough for moss to grow on the hull.  About three months.,15,1
Katara, So dad's probably long gone.,15,1
Sokka, I wonder why they left this boat? There's nothing wrong with it.,15,1
Aang,When was the last time you saw your dad?,15,1
Sokka, I don't want to talk about it.,15,1
Aang, I didn't mean to bring that up.,15,1
Katara," It's okay Aang. Our dad left about two years ago, with all the other Water Tribe men.",15,1
Sokka, Maybe we should all get some sleep.,15,1
Katara, This should give us a good idea of what's around here.,16,1
Sokka,,16,1
Aang,"I bet we'll find something to eat here,  This would be a great place for me to study some real firebenders.",16,1
Sokka, You might wanna rethink that. Look at this.,16,1
Aang," Hey, a poster of me!",16,1
Sokka,A wanted poster! This is bad. ,16,1
Katara, I think we better keep moving.,16,1
Aang, I have to learn firebending at some point and this could be my only chance to watch a master's up close.,16,1
Katara,,16,1
Sokka,,16,1
Katara," We'll wear disguises and if it looks like trouble, we'll leave.",16,1
Sokka, Yeah! Because we always leave before we get into trouble.,16,1
Aang, Ready disguises!,16,1
Sokka,,16,1
Aang,Let's go.,16,1
Katara,I think we need some new disguises.,16,1
Sokka,Where are we gonna get masks like that?,16,1
Mask dealer,Get your genuine Fire Festival masks here!,16,1
Sokka,That was surprisingly easy.,16,1
Aang,"Hey, there's some food.",16,1
Sokka,Finally!  What do you have?,16,1
Shop keeper,Flaming fire flakes! Best in town.,16,1
Sokka,I'll take'em!,16,1
Sokka,Aaahhh! Hot! Hot!,16,1
Katara," ""Flaming fire flakes"", hot? What do you know?",16,1
Aang,"Hey, look at this.",16,1
Puppet Fire Lord,Don't worry loyal citizens! No one can surprise the Fire Lord!,16,1
Fire Nation kids,,16,1
Katara,"Aang, hold on! Where are we going?",16,1
Aang,"I don't know, but there's a big crowd so it must be good.",16,1
Sokka," Knowing the Fire Nation, it's probably an execution.",16,1
Aang,I gotta learn that trick!,16,1
Malu,Thank you! For my next trick I need a volunteer from the audience!,16,1
Aang, Oh! Oh! Me! Me!,16,1
Sokka, What do you think you're doing?,16,1
Aang,I want to get a closer look.,16,1
Katara,It's better that we don't attract any attention to ourselves.,16,1
Malu,"How about you, little lady?",16,1
Katara, Uh.,16,1
Malu,"Awww, she's shy. Leeet's give her some encouragement, folks!",16,1
Aang, Awww! That could've been me.,16,1
Malu,"This next trick is called ""Taming the Dragon.""  You will be my captured princess! Don't worry, young maiden! I will tame this fiery beast! It's too strong, I can't hold it!",16,1
Aang,We gotta help her!,16,1
Sokka,"No, we don't want to make a scene!",16,1
Malu,"The rope, it's breaking!  Hey, you tryin' to upstage me, kid?",16,1
Citizen,Hey! That kid's the Avatar! ,16,1
Sokka,I think it's time to go.,16,1
Chey,Follow me! I can get you outta here! ,16,1
Guard,There they are!,16,1
Guard,Over there!,16,1
Aang,I'm calling Appa. ,16,1
Sokka,I hope he can really hear that bison whistle!,16,1
Chey, Okay! Not this way!,16,1
Aang,Appa! Down here!,16,1
Aang,Nice touch setting off the fireworks.,16,1
Sokka, You really know your explosives ...,16,1
Chey,I'm familiar.,16,1
Sokka,You're a Fire Nation Soldier!,16,1
Chey,Was.  My name's Chey.,16,1
Chey,"I serve a man. More than a man really, he's a myth, but he's real, a living legend, Jeong Jeong the Deserter. He was a Fire Nation general, or wait, was he an admiral?",16,1
Sokka," He was very highly ranked, we get it.",16,1
Chey,"Yeah! Way up there! But he couldn't take the madness any more. He's the first person ever to leave the army - and live. I'm the second, but you don't get to be a legend for that. That's okay though. Jeong Jeong's a firebending genius. Some say he's mad - but he's not! He's enlightened.",16,1
Aang,You mean there's a firebender out here who's not with the Fire Lord?  We've gotta go see him! He can train me!,16,1
Sokka, We're  not  gonna go find some  crazy  firebender!,16,1
Chey, He's not crazy! He's a genius! And he's the perfect person to train the Avatar! That's why I followed you into the festival.,16,1
Sokka,"Look, thanks for the help, but we're leaving for the North Pole in the morning.",16,1
Aang,"Sokka, this could be my only chance to meet a firebending master who would actually be willing to teach me.",16,1
Katara,It can't hurt just to talk to him.,16,1
Sokka, That's what you said about going to the festival! Why doesn't anyone ever listen to me?,16,1
Lin Yee,Don't move!,16,1
Lin Yee, Jeong Jeong told you not to look for Avatar!,16,1
Sokka,"Hold on, you know these guys?",16,1
Chey,"Oh yeh! Lin Yee's an old buddy! Right, Lin Yee?",16,1
Lin Yee, Shut up! Keep moving.,16,1
Lin Yee,Go on. He sees you only.,16,1
Chey,"Oh that's okay, we can chat later.",16,1
Aang,Is that where Jeong Jeong is? I need to talk to him right away.,16,1
Lin Yee,No! You wait there.  Go now!,16,1
Chey,"Don't worry! Everything'll be fine. He's a great man, great man!",16,1
Zhao,"So, the Avatar was here and you let him slip away?",16,1
Guard captain, No fights. Theft was way down.,16,1
Zhao, I don't care about your local crime rates! Which way did they go?,16,1
Guard captain,"They headed into the forest, up the river I suspect.",16,1
Zhao,Ready the river boats. We're going after the Avatar.,16,1
Aang,What happened? Can I see Jeong Jeong now?,16,1
Chey, He won't see you. He's very angry that I brought you here. He wants you to leave immediately.,16,1
Sokka,Finally! Let's hit the road. ,16,1
Aang,Why won't he see me?,16,1
Chey,He says you're not ready. Says you haven't mastered waterbending and earthbending yet.,16,1
Aang," Wait, how does he know that?",16,1
Chey,He saw the way you walked into camp. He could tell.,16,1
Aang,"I'm going in, anyway!",16,1
Jeong Jeong,Get out.,16,1
Aang,"Master, I need to learn firebending.",16,1
Jeong Jeong,Only a fool seeks his own destruction.,16,1
Aang,,16,1
Jeong Jeong,"Destiny? What would a boy know of destiny? If a fish lives its whole life in this river, does he know the river's destiny? No! Only that it runs on and on out of his control! He may follow where it flows, but he cannot see the end. He cannot imagine the ocean.",16,1
Aang,"Okay, but it's the Avatar's duty to master all of the bending disciplines.",16,1
Jeong Jeong,"To master the bending disciplines, you must first master discipline itself. But you have no interest in this, so I have no interest in you! Now, get out.",16,1
Aang,"Please, I have to learn. This could be my only chance.",16,1
Jeong Jeong,"Are you deaf? How can I teach you if you refuse to listen? Before learning firebending you must learn water and earth. Water is cool and soothing, earth is steady and stable, but fire, fire is alive! It breathes, it grows. Without the bender, a rock will not throw itself! But fire will spread and destroy everything in its path if one does not have the will to control it! That is its destiny! You are not ready! You are too weak!",16,1
Roku,You think I am weak?,16,1
Jeong Jeong,"Avatar Roku! No, No! I did not mean that.",16,1
Roku,"I have mastered the elements a thousand times in a thousand lifetimes. Now, I must do it once again. You will teach the Avatar  firebending.",16,1
Jeong Jeong,"Yes, yes, I will teach you.",16,1
Aang,Really? That's great! ,16,1
Jeong Jeong,"Widen your stance. Wider! Bend your knees. Now, concentrate.  Good, good!",16,1
Aang,Wait! What do I do now?,16,1
Jeong Jeong, Even that oaf knows to concentrate on what he's doing!,16,1
Sokka,  Hey  !,16,1
Aang,But what am I concentrating on?,16,1
Jeong Jeong,"Feel the heat of the sun. It is the greatest source of fire. Yet, it is in complete balance with nature!",16,1
Aang,So when do I get to make some fire?,16,1
Jeong Jeong,Concentrate!,16,1
Aang,Are we coming up here so I don't burn anything with my fire blasts?,16,1
Jeong Jeong,No fire yet.,16,1
Aang,What?,16,1
Jeong Jeong,Power in firebending comes from the breath. That is why you must master proper breath control.,16,1
Aang,You brought me up here to breathe?,16,1
Jeong Jeong,Assume your stance.,16,1
Jeong Jeong, Wider.,16,1
Aang,You're not even look ,16,1
Jeong Jeong,"Wider!  Now, inhale through the nose and exhale through the mouth - without talking. Good. Keep going.",16,1
Jeong Jeong,What are you doing here? I did not tell you to stop!,16,1
Aang,I've been breathing for hours!,16,1
Jeong Jeong,You want to stop breathing?,16,1
Aang,I want you to stop wasting my time! I already know how to squat and breathe and feel the sun!  I wanna know how to shoot fire out of my fingertips!,16,1
Jeong Jeong,,16,1
Jeong Jeong,"Learn restraint, or risk destroying yourself and everything you love.",16,1
Aang,"I thought about what you said, I promise I'll be more patient.",16,1
Jeong Jeong,We're going to work with fire now.,16,1
Aang,"Oh yeah!  I mean, let us begin.",16,1
Jeong Jeong,Concentrate on the fire. I want you to keep the flame from reaching the edges of the leaf for as long as you can.,16,1
Tribal man,Master! There is trouble.,16,1
Aang,What's going on?,16,1
Jeong Jeong,Concentrate on your leaf!,16,1
Aang, This is the  worst  firebending instruction ever! All he does is leave me for hours to concentrate or breathe!,16,1
Katara,I'm sure there's a good reason.,16,1
Aang,But I'm ready to do so much more.,16,1
Aang, I did it! I made fire!,16,1
Katara,"Aang, that's great, but you should take it slow.",16,1
Aang,Now  that's  some firebending!,16,1
Katara,"Aang, you'll hurt yourself!",16,1
Aang,I wonder how that juggler did it.,16,1
Aang,Katara! I'm so sorry!,16,1
Sokka, What did you do?!,16,1
Aang,"It was an accident! I was, uh... Katara, I'm so--",16,1
Sokka, This is all your fault!,16,1
Jeong Jeong,I know! Now pack your things. You must leave immediately.,16,1
Aang,"I'm sorry, I didn't ... ",16,1
Jeong Jeong,You have healing abilities. The great benders of the Water Tribe sometimes have this ability. I've always wished I were blessed like you - free from this burning curse.,16,1
Katara,But you're a great master. You have powers that I will never know.,16,1
Jeong Jeong,"Water brings healing and life. But fire brings only destruction and pain. It forces those of us burdened with its care to walk a razor's edge between humanity and savagery. Eventually, we are torn apart.",16,1
Jeong Jeong,Go get your friends and flee! Do not come back here or you will all be destroyed. Hurry!,16,1
Zhao,"Don't worry, men. My old teacher gave up fighting a long time ago.  Haven't you, Master Jeong Jeong?",16,1
Sokka,Katara! Are you all right?,16,1
Katara,"I'm fine, we've got to get out of here. Where's Aang? ",16,1
Aang,Jeong Jeong tried to tell me that I wasn't ready. I wouldn't listen. I'm never going to firebend again.,16,1
Katara,You'll have to eventually.,16,1
Aang,"No, never again.",16,1
Katara,"It's okay, Aang. I'm healed.",16,1
Aang, What? How?,16,1
Katara,"I'll explain later. But right now, we have to get out here. Zhao and his soldiers are attacking!",16,1
Aang, Where?,16,1
Katara,By the river. They captured Jeong Jeong.,16,1
Aang,I have to help him!,16,1
Zhao,Look at you. You were once so great. I can't believe my former master has become nothing more than a simple savage.,16,1
Jeong Jeong,"It is you who have embraced savagery, Zhao.",16,1
Zhao,"It's Admiral Zhao, now.",16,1
Jeong Jeong,That title will not help you against the Avatar. Do not try to fight him! You are no match!,16,1
Zhao, I think I can handle a child.,16,1
Jeong Jeong,I have never seen such raw power ...,16,1
Aang,Jeong Jeong!,16,1
Zhao,We'll see. Men! Take the deserter!,16,1
Zhao, Let's find out what my old master has taught you.,16,1
Aang, You were Jeong Jeong's student?!,16,1
Zhao,Until I got bored.,16,1
Zhao,I see he taught you how to duck and run like a coward. But I doubt he showed you what a firebender is truly capable of! ,16,1
Aang,Whoa! Wild shot!,16,1
Zhao, I'll show you  wild  !,16,1
Aang,No self-control ... ,16,1
Zhao,"Stand and fight, Avatar!",16,1
Aang," Oh, were we fighting? I thought you were just getting warmed up!",16,1
Zhao,,16,1
Aang,"Is that all you got? Man, they'll make anyone an admiral these days!  Sloppy. Very sloppy.",16,1
Zhao,"Nowhere to run now, you little smart mouth!",16,1
Aang, You've lost this battle.,16,1
Zhao, Are you crazy? You haven't thrown a single blow!,16,1
Aang,"No  , but  you  have.  Have a nice walk home!",16,1
Sokka,"Aang, come on! Let's go!",16,1
Aang,Wait! Where's Jeong Jeong?,16,1
Sokka,He disappeared. They all did.,16,1
Chey, Very funny guys,16,1
Katara,"Aang, you're burned! Let me help you. ",16,1
Aang,"Wow, that's good water.",16,1
Sokka,When did you learn that?,16,1
Katara,I guess I always knew.,16,1
Sokka, Or that time I had two fishhooks in my thumb!,16,1
Aang, Two?,16,1
Katara, He tried to get the first fishhook out with another fishhook.,16,1
Sokka," Oh, and the time that mink snake bit me! Thanks for healing that up. That was great. Really helpful.",16,1
Storyteller," So, travelers. The next time you think you hear a strange, large bird talking, take a closer look. It might not be a giant parrot, but a flying man. A member of a secret group of air walkers, who laugh at gravity, and laugh at those bound to the earth by it!",17,1
Aang,,17,1
Katara, Was it realistic? Is that how it was back then?,17,1
Aang,I laugh at gravity all the time.  Gravity.,17,1
Storyteller,,17,1
Sokka,Sorry ...,17,1
Storyteller,,17,1
Aang, Hey! Thanks for the story.,17,1
Storyteller," Tell it to the cap,  boy.",17,1
Storyteller,"Aww, much obliged, little bat-thing. ",17,1
Aang, It means a lot to hear airbender stories. It must have been a hundred years ago your great grandpa met them.,17,1
Storyteller,,17,1
Aang," Hey, we're almost at the Northern Air Temple. This is where they had the championships for Sky Bison polo.",17,1
Katara, Do you think we'll really find airbenders?,17,1
Sokka," You want me to be like you, or totally honest?",17,1
Katara, Are you saying I'm a liar?,17,1
Sokka," I'm saying you're an optimist. Same thing, basically.",17,1
Aang," Hey, guys, look at this!",17,1
Katara, They really are airbenders!,17,1
Aang," No, they're not.",17,1
Sokka," What do you mean ""they're not""? Those guys are flying!",17,1
Aang," Gliding maybe, but not flying. You can tell by the way they move, they're not airbending. Those people have no spirit.",17,1
Katara,"I don't know, Aang.",17,1
Sokka,"We better find some solid ground, before it finds us. ",17,1
Colonists, Go Teo! Show that bald kid how it's done!,17,1
Teo," Hey there, you're pretty good!",17,1
Aang," Yeah, I know. But I can do more than fancy gliding.",17,1
Teo," Wow, I don't think I can do that. But here's a good one.",17,1
Teo,What do you think?,17,1
Aang, It's great.,17,1
Teo,"Hey, you're a real airbender. You must be the Avatar! That's amazing! I-I've heard stories about you!",17,1
Aang, Thanks.,17,1
Sokka, Wow! This glider chair is incredible!,17,1
Teo,"You think this is good, wait until you see the other stuff my dad designed.",17,1
Sokka,Wow! ,17,1
Teo,"Yeah, my dad is the mastermind behind this whole place. Everything's powered by hot air.  It even pumps hot air currents outside to give us a lift while we're gliding.",17,1
Aang, This place is unbelievable.,17,1
Teo,"Yeah, it's great, isn't it?",17,1
Aang,"No, just unbelievable. ",17,1
Katara, Aang used to come here a long time ago. I think he's a little shocked it's so ... different.,17,1
Sokka,So better!,17,1
Aang,This is supposed to be the history of my people.,17,1
Aang,Ugh!,17,1
Katara, I'm sure some parts of the temple are still the same.,17,1
Aang,It's nice to see that at least one part of the temple that isn't ruined.,17,1
Man, Look out!,17,1
Mechanist,What the doodle? Don't you know enough to stay away from construction sites? We have to make room for the bathhouse! ,17,1
Aang, Do you know what you did!? You just destroyed something sacred! For a stupid bathhouse!,17,1
Mechanist,"Well, people around here are starting to stink. ",17,1
Aang,,17,1
Aang,This is a sacred temple! You can't treat it this way!  I've seen it when the monks were here! I know what it's supposed to be like!,17,1
Mechanist,"The monks? But,  you're twelve.",17,1
Teo," Dad, he's the Avatar. He used to come here a hundred years ago.",17,1
Aang,What are you doing? Who said you could be here?,17,1
Mechanist, I came across these fan-like contraptions!,17,1
Aang,Our gliders.,17,1
Mechanist,"Yes! Little, light flying machines!  And, after all, isn't that what nature does?",17,1
Aang,Nature knows where to stop.,17,1
Mechanist,"I suppose that's true. Unfortunately, progress has a way of getting away from us. Look at the time!  The pulley system must be oiled before dark.",17,1
Sokka,"Wait, how can you tell the time from that thing? The notches all look the same.",17,1
Mechanist,The candle will tell us. Watch. ,17,1
Sokka,You put spark powder in the candle!,17,1
Mechanist,"Four flashes. So it's exactly four hours past mid-day. Or, as I call it: four o'candle. ",17,1
Sokka, Aaah!,17,1
Mechanist,,17,1
Teo,"Hey, Aang. I want to show you something.",17,1
Aang,I just can't get over it. There's not a single thing that's the same.,17,1
Teo,I don't know about that. The temple might be different  are probably direct descendants of the ones who lived here a long time ago.,17,1
Katara,,17,1
Teo,"Besides, there's one part of the temple that hasn't changed at all.",17,1
Katara,"Hey, it's just like the one in the other temple!",17,1
Teo," Only an airbender can open it, so inside it's completely untouched. Just the way the monks left it. I've always wondered what it's like in there ...",17,1
Katara, Aang?,17,1
Aang, I'm sorry. This is the last part of the temple that's the same as it was. I want it to stay that way.,17,1
Teo, I completely understand. I just wanted you to know that it's here.,17,1
Aang,Thanks. ,17,1
Sokka,These lanterns are terrible. I can't see! ,17,1
Mechanist,Hey! Close that up! They'll get loose! ,17,1
Mechanist,Cover your nose ,17,1
Sokka, Okay ... so you brought me all the way down here to see an empty room.,17,1
