character,dialog,episode,season
Katara,"Water. Earth. Fire. Air. My grandmother used to tell me stories about the old days: a time of peace when the Avatar kept balance between the Water Tribes, Earth Kingdom, Fire Nation and Air Nomads. But that all changed when the Fire Nation attacked. Only the Avatar mastered all four elements; only he could stop the ruthless firebenders. But when the world needed him most, he vanished. A hundred years have passed, and the Fire Nation is nearing victory in the war. Two years ago, my father and the men of my tribe journeyed to the Earth Kingdom to help fight against the Fire Nation, leaving me and my brother to look after our tribe. Some people believe that the Avatar was never reborn into the Air Nomads and that the cycle is broken, but I haven't lost hope. I still believe that, somehow, the Avatar will return to save the world.",1,1
Sokka,"It's not getting away from me this time.  Watch and learn, Katara.  This  is how you catch a fish.",1,1
Katara," Sokka, look!",1,1
Sokka, Mmmm ... I can already smell it cookin'.,1,1
Katara," But, Sokka! I caught one!",1,1
Katara, Hey!,1,1
Sokka,"Why is it that every time  you  play with magic water,  I  get soaked?",1,1
Katara," It's not ""magic"", it's waterbending! And it's ...",1,1
Sokka," that if I had weird powers, I'd keep my weirdness to myself.",1,1
Katara, You're calling  me  weird? I'm not the one who makes muscles at myself every time I see my reflection in the water!,1,1
Katara,Watch out! Go left! Go left!,1,1
Katara, You call that  left?,1,1
Sokka,"You don't like my steering? Well, maybe you should've   waterbended  us out of the ice.",1,1
Katara, So it's my fault?,1,1
Sokka, Leave it to a girl to screw things up!,1,1
Katara,"You are the most sexist,  to be related to you!",1,1
Katara,"Ever since mom died,   I've  been doing all the work around camp while  you've  been off playing soldier!",1,1
Sokka, Uh ... Katara ...,1,1
Katara," I even wash all the clothes! Have you ever smelled your dirty socks? Let me tell you,  not pleasant!",1,1
Sokka," Katara, settle down!",1,1
Katara,"No that's it! I'm  done  helping you! From now on, you're  on your own!",1,1
Sokka,"Okay, you've gone from ""weird"" to ""freakish"",  Katara.",1,1
Katara, You mean  I  did that?,1,1
Sokka, Congratulations.,1,1
Katara,He's alive! We have to help!,1,1
Sokka,"Katara, get back here!  We don't know what that  thing  is!",1,1
Zuko,"Finally!  Uncle, do you realize what this means?!",1,1
Iroh, I won't get to finish my game?,1,1
Zuko, It means my search is about to come to an end.,1,1
Zuko, It has to be him!,1,1
Iroh," Please, sit. Why don't you enjoy a cup of calming Jasmine tea?",1,1
Zuko," I don't need any calming tea! I need to capture the Avatar! Helmsman, head a course for the light!",1,1
Sokka, Stop!,1,1
Katara, Stop it!,1,1
Aang, I need to ask you something ...,1,1
Katara,What?,1,1
Aang,Please ... come closer.,1,1
Katara, What is it?,1,1
Aang, Will you go penguin sledding with me?,1,1
Katara," Uh, sure ... I-I guess.",1,1
Aang, What's going on here?,1,1
Sokka,,1,1
Aang, I'm not sure.,1,1
Aang," Wake up, buddy.",1,1
Aang," Ha, ha! You're okay!",1,1
Sokka,What  is  that thing?,1,1
Aang,"This is Appa, my flying bison.",1,1
Sokka,,1,1
Aang, So do you guys live around here?,1,1
Sokka,  Don't  answer that! Did you see that crazy bolt of light?! He was probably trying to signal the Fire Navy!,1,1
Katara," The paranoid one is my brother, Sokka. You never told us your name.",1,1
Aang,I'm A ... a-a-a-Achoo! ,1,1
Sokka, and flew ten feet in the air!,1,1
Aang, Really? It felt higher than that.,1,1
Katara, You're an airbender!,1,1
Aang,Sure am!,1,1
Sokka,"Giant light beams, flying bison, airbenders ... ",1,1
Aang,"Well, if you guys are stuck, Appa and I can give you a lift. ",1,1
Katara,We'd love a ride! Thanks! ,1,1
Sokka,Oh no! I'm not getting on that fluffy  snot  monster!,1,1
Katara," Are you hoping some other kind of monster will come along and give you a ride home? You know, before you  freeze  to death?",1,1
Aang,"Okay, first time flyers, hold on tight! Appa, yip-yip!",1,1
Aang,"Come on, Appa. Yip-yip!",1,1
Sokka," Wow, that was  truly  amazing ...",1,1
Aang,,1,1
Katara, Why are you smiling at me like that?,1,1
Aang,"Oh, I was smiling? ",1,1
Iroh,"I'm going to bed now.  Prince Zuko, you need some sleep. Even if you're right, and the Avatar is alive, you won't find him. Your father, grandfather and great-grandfather all tried and failed.",1,1
Zuko,Because their  honor  didn't hinge on the Avatar's capture. Mine  does.  This coward's hundred years in hiding are over.,1,1
Katara,Hey.,1,1
Aang,Hey. What'cha thinkin' about?,1,1
Katara,"I guess I was wondering, your being an airbender and all, if you had any idea what happened to the Avatar?",1,1
Aang,"Oh, no. I didn't know him. I mean, I knew people that knew him, but I didn't. Sorry. ",1,1
Katara,Okay. Just curious.  Good night.,1,1
Aang,Sleep tight.,1,1
Katara,Aang? Aang! Wake up.  Everyone's waiting to meet you.,1,1
Katara,"Aang,  this  is the entire village.  Entire village, Aang.",1,1
Aang," Uh, why are they all looking at me like that? Did Appa sneeze on me?",1,1
Kanna,"Well, no one has seen an airbender in a hundred years. We thought they were extinct, until my granddaughter and grandson found you.",1,1
Aang, Extinct?,1,1
Katara," Aang, this is my grandmother.",1,1
Kanna, Call me Gran-Gran.,1,1
Sokka," What is this, a weapon? You can't  stab  anything with this!",1,1
Aang,,1,1
Village girl, Magic trick! Do it again!,1,1
Aang,"Not magic, airbending.  It lets me control the air currents around my glider and fly.",1,1
Sokka," Ya know, last time I checked, humans  can't fly!",1,1
Aang, Check again!,1,1
Village girl, He's flying!,1,1
Village girl,It's amazing!,1,1
Sokka, My watchtower!,1,1
Katara, That was  amazing!,1,1
Sokka,,1,1
Aang, You're a waterbender?,1,1
Katara," Well, sort of. Not yet.",1,1
Kanna,"All right, no more playing. Come on, Katara, you have chores.",1,1
Katara," I told you, he's the real thing Gran-Gran! I finally found a bender to teach me!",1,1
Kanna," Katara, try not to put all your hopes in this boy.",1,1
Katara,But he's special! I can tell!  I sense he's filled with  much  wisdom.,1,1
Aang, See? Now my tongue is stuck to my staff!,1,1
Iroh, Again.,1,1
Iroh, Get it right this time.,1,1
Zuko, Enough! I've been drilling this sequence all day. Teach me the next set! I'm  more  than ready!,1,1
Iroh,"No, you are impatient.  Drill it again!",1,1
Zuko, You  will  teach me the advanced set!,1,1
Iroh,,1,1
Sokka,,1,1
Southern Water Tribe boy, I gotta pee!,1,1
Sokka,,1,1
Southern Water Tribe boy,But I really gotta go!,1,1
Sokka," Okay, who else has to go?",1,1
Katara, Have you seen Aang? Gran-Gran said he disappeared over  an hour  ago.,1,1
Aang, Wow!  Everything  freezes in there!,1,1
Sokka," Katara, get him out of here! This lesson is for warriors  only  !",1,1
Village boy,Whee!,1,1
Sokka, What's wrong with you?! We don't have time for fun and games with  the War  going on!,1,1
Aang, What war? What are you talking about?,1,1
Sokka," You're kidding, right?",1,1
Aang, Penguin!,1,1
Sokka,"He's kidding, right?",1,1
Katara,Aang?,1,1
Aang, Heh heh. I have a way with animals.,1,1
Katara," Hehehe, Aang, I'll help  you  catch a penguin if you teach  me  waterbending.",1,1
Aang," I'm an airbender, not a waterbender. Isn't there someone in your tribe who can teach you?",1,1
Katara, No. You're looking at the  only  waterbender in the whole South Pole.,1,1
Aang,"This isn't right. A waterbender needs to master water.  What about the North Pole? There's another Water Tribe up there, right? Maybe they have waterbenders who could teach you.",1,1
Katara,"Maybe, but we haven't had contact with our sister tribe in a long time. It's not exactly ""turn right at the second glacier"". It's on the other side of  the world  .",1,1
Aang,"But you forget,  I  have a flying bison.  Appa and I can  personally  fly you to the North Pole. Katara, we're going to find you a master!",1,1
Katara," That's ... I mean, I don't know. I've never left home before.",1,1
Aang,"Well, you think about it, but in the meantime, can you teach me to catch one of these penguins?",1,1
Katara, Observe!,1,1
Aang,"Hi hi hi! Ha, ha, ha!",1,1
Katara, I haven't done this since I was a kid!,1,1
Aang,You still  are  a kid!,1,1
Aang, Whoa! What is  that?,1,1
Katara," Aang, stop! We're not allowed to go near it! The ship could be booby-trapped!",1,1
Aang,"If you want to be a bender, you  have  to let go of fear.",1,1
Katara, It was part of the Fire Nation's first attacks.,1,1
Aang,"Okay, back up. I have friends  all over  the world, even in the Fire Nation.  I've never seen  any  war.",1,1
Katara,"Aang, how long were you in that iceberg?",1,1
Aang," I don't know. A few days, maybe?",1,1
Katara,I think it was more like a hundred  years!,1,1
Aang, What?! That's impossible! Do I look like a hundred-twelve-year-old man to you?,1,1
Katara,"Think about it. The War is a century old. You don't know about it because, somehow, you were in there the whole time!  It's the only explanation.",1,1
Aang,A hundred years!  I can't believe it.,1,1
Katara," I'm sorry, Aang. Maybe somehow there's a bright side to all this ...",1,1
Aang, I  did  get to meet you.,1,1
Katara," Come on, let's get out of here.",1,1
Katara,"Aang, let's head back, this place is creepy.",1,1
Aang,Huh?,1,1
Aang,What's that you said about booby traps?,1,1
Aang,Uh oh ...  Hold on tight!,1,1
Katara,Aaah!,1,1
Zuko,The last airbender!  As  well  as his hiding place ...,1,1
Katara,"Water. Earth. Fire. Air. Long ago, the four nations lived together in harmony. Then, everything changed when the Fire Nation attacked. Only the Avatar, master of all four elements, could stop them, but when the world needed him most, he vanished. A hundred years passed, and my brother and I discovered the new Avatar, an airbender named Aang. And although his airbending skills are great, he has a lot to learn before he's ready to save anyone. But I believe Aang can save the world.",2,1
Village kids, Yay! Aang's back!,2,1
Sokka," You signaled the Fire Navy with that flare! You're leading them straight to us, aren't you?",2,1
Katara, Aang didn't do anything! It was an accident.,2,1
Aang, -- we booby-ed right into it.,2,1
Kanna," Katara, you shouldn't have gone on that ship! Now we could  all  be in danger!",2,1
Aang, Don't blame Katara. I brought her there. It's my fault.,2,1
Sokka, The foreigner is banished from our village.,2,1
Katara," Sokka, you're making a mistake.",2,1
Sokka," I'm protecting you, from threats like him!",2,1
Katara, Don't you see? Aang's brought us something we haven't had in a long time: fun.,2,1
Sokka, Fun?! We can't fight firebenders with fun!,2,1
Aang, You should try it sometime.,2,1
Sokka, Get out of our village!  Now!,2,1
Katara," Grandmother, please.  Don't  let Sokka do this!",2,1
Kanna," Katara, you knew going on that ship was forbidden. Sokka is right. I think it best if the airbender leaves.",2,1
Katara," Come on Aang, let's go.",2,1
Sokka, Where do you think  you're  going?,2,1
Katara, To find a waterbender. Aang is taking  me  to the North Pole.,2,1
Aang, Great!,2,1
Sokka,Katara! Would you really choose him over your tribe?  Your own family?,2,1
Aang," Katara, I don't want to come between you and your family.",2,1
Katara, This is goodbye?,2,1
Aang,Thanks for penguin sledding with me.,2,1
Katara, Where will you go?,2,1
Aang,Guess I'll go back home and look for the airbenders.  It was nice meeting everyone.,2,1
Sokka," Let's see your bison fly now,  air boy.",2,1
Aang," Come on Appa, you can do it. Yip-yip!",2,1
Sokka," Yeah, I thought so!",2,1
Southern Water Tribe girl," Aang, don't go! I'll miss you!",2,1
Aang," Come on, boy.",2,1
Kanna,,2,1
Katara, There goes my  one  chance at becoming a waterbender!,2,1
Sokka,"All right, ready our defenses! The Fire Nation could be on our shores any moment now!",2,1
Southern Water Tribe boy, But I gotta ...,2,1
Sokka, And  no  potty breaks!,2,1
Aang," Appa, wait here.",2,1
Sokka, Oh man!,2,1
Sokka, Oh maaan ...,2,1
Katara," Sokka, get out of the way!",2,1
Zuko, Where are you hiding him?,2,1
Zuko," He'd be about this age, master of  all  elements?",2,1
Zuko, I  know  you're hiding him!,2,1
Village boy,Show no fear!,2,1
Aang," Hey, Katara. Hey, Sokka.",2,1
Sokka," Hi, Aang. Thanks for coming.",2,1
Aang,Looking for me?,2,1
Zuko,  You're  the airbender?  You're  the Avatar?,2,1
Katara, Aang?,2,1
Sokka, No way!,2,1
Zuko,"I've spent years preparing for this encounter. Training, meditating.  You're just a child!",2,1
Aang," Well, you're just a teenager.",2,1
Aang,"If I go with you,  will you promise to leave everyone alone?",2,1
Katara," No! Aang,  don't  do this!",2,1
Aang, Take care of Appa for me until I get back.,2,1
Zuko, Head a course for the Fire Nation. I'm going home.,2,1
Katara," We have to go after that ship, Sokka. Aang saved our tribe, now we have to save him.",2,1
Sokka,"Katara, I --",2,1
Katara," If we don't help him, no one will. I know you don't like Aang, but we owe him and --",2,1
Sokka," Are you gonna talk all day, or are you comin' with me?",2,1
Katara,,2,1
Sokka," Get in, we're going to save your boyfriend.",2,1
Katara, He's not my --,2,1
Sokka, Whatever.,2,1
Kanna, What do you two think you're doing?,2,1
Kanna," And you, my brave warrior, be nice to your sister.",2,1
Sokka,,2,1
Kanna,Aang is the Avatar. He's the world's only chance. You both found him for a reason. Now your destinies are intertwined with his.,2,1
Katara, There's no way we're going to catch a warship with a  canoe.,2,1
Katara,,2,1
Sokka," You just looove taking me out of my comfort zone, don't you?",2,1
Zuko,This staff will make an excellent gift for my father.  and take this to my quarters.,2,1
Iroh," Hey, you mind taking this to his quarters for me?",2,1
Aang," So, I guess you've never fought an airbender before. I bet I could take you  both  with my hands tied behind my back.",2,1
Firebender, Silence.,2,1
Firebender,The Avatar has escaped!,2,1
Sokka, Soar.,2,1
Katara," Please, Appa. We need your help.  Aang  needs your help.",2,1
Sokka, Up. Ascend. Elevate.,2,1
Katara,"Sokka doesn't believe you can fly, but I do, Appa. ",2,1
Sokka,What was it that kid said? Yee-haw? Hup-hup? Wah-hoo? Uh ... Yip-yip?,2,1
Katara," You did it, Sokka!",2,1
Sokka," He's flying! He's flying! Katara, he's -",2,1
Sokka,,2,1
Aang,"You haven't seen my staff around, have you?",2,1
Aang, Thanks anyway!,2,1
Aang, Sorry!,2,1
Aang,My staff!,2,1
Zuko,Looks like I underestimated you.,2,1
Zuko, What is that?,2,1
Aang, Appa!,2,1
Katara, Aang! No!,2,1
Katara, Aang! Aang! Aang!,2,1
Katara, Did you see what he just did?!,2,1
Sokka, Now  that  was some waterbending!,2,1
Katara, Aang! Are you okay?,2,1
Aang," Hey, Katara. Hey, Sokka. Thanks for coming.",2,1
Sokka,"Well, I couldn't let you have  all  the glory.",2,1
Aang, I dropped my staff.,2,1
Sokka, Got it!,2,1
Sokka, Ha! That's from the Water Tribe!,2,1
Sokka, Katara!,2,1
Katara," Hurry up, Sokka!",2,1
Sokka, Yip-yip! Yip-yip!,2,1
Iroh, Duh? Huh?,2,1
Zuko, Shoot them down!,2,1
Iroh, Good news for the Fire Lord. The Fire Nation's greatest  threat  is just a little kid.,2,1
Zuko, Dig the ship out and follow them!,2,1
Zuko, As soon as you're done with that.,2,1
Katara, How did you do that?! With the water? It was the most  amazing  thing I've  ever  seen!,2,1
Aang, I don't know. I just sort of ... did it.,2,1
Katara, Why didn't you tell us  you  were the Avatar?,2,1
Aang,Because ...  I never wanted to be.,2,1
Katara,"But Aang, the world's been  waiting  for the Avatar to return and finally put an end to this war.",2,1
Aang, And how am I going to do that?,2,1
Katara,"According to legend, you need to first master water, then earth, then fire, right?",2,1
Aang, That's what the monks told me.,2,1
Katara," Well, if we go to the North Pole, you can master waterbending!",2,1
Aang, We can learn it together!,2,1
Katara," And Sokka, I'm sure you'll get to knock some firebender heads on the way.",2,1
Sokka, I'd like that. I'd  reeally  like that.,2,1
Katara, Then we're in this together!,2,1
Aang," Here, here and here.",2,1
Katara,,2,1
Aang," They don't like people riding them, but that's what makes it fun!",2,1
Aang," Wait 'til you see it, Katara! The Air Temple is one of the most  beautiful  places in the world!",3,1
Katara, but it's been a hundred years since you've been home.,3,1
Aang, That's  why  I'm so excited!,3,1
Katara, It's just that ... a lot can change in all that time.,3,1
Aang," I know, but I need to see it for myself.",3,1
Aang,,3,1
Sokka, Uggh! Sleep now. Temple later.,3,1
Aang, There's a prickle snake in your sleeping bag!,3,1
Sokka, Ahh!,3,1
Aang, Great! You're awake! Let's go!,3,1
Zuko,"Uncle, I want the repairs made as quickly as possible. I don't want to stay too long and risk losing his trail.",3,1
Iroh, You mean the Avatar?,3,1
Zuko," Once word gets out that he's alive, every firebender will be out looking for him, and I don't want anyone getting in the way!",3,1
Zhao, Prince Zuko?,3,1
Zuko, Captain Zhao.,3,1
Zhao, General Iroh. Great hero of our nation.,3,1
Iroh,  Retired  general.,3,1
Zhao,The Fire Lord's brother and son are welcome guests anytime. What brings you to my harbor?,3,1
Iroh,Our ship is being repaired.,3,1
Zhao,That's quite a bit of damage.,3,1
Zuko,Yes.  Uncle! Tell Commander Zhao what happened.,3,1
Iroh, What? Did we crash or something?,3,1
Zuko, Yes! Right into ... an Earth Kingdom ship!,3,1
Zhao, Join me for a drink?,3,1
Zuko," Sorry, but we have to go.",3,1
Iroh,"Prince Zuko, show Commander Zhao your respect.  We would be honored to join you. Do you have any ginseng tea? It's my favorite.",3,1
Sokka," Hey, stomach? Be quiet, all right? I'm  trying  to find us some food.",3,1
Sokka, Hey! Who ate all of my blubbered seal jerky?!,3,1
Aang, Sorry.,3,1
Sokka, No wonder the flames smelled so good.,3,1
Aang, The Patola Mountain range! We're almost there!,3,1
Katara," Aang, before we get to the temple, I want to talk to you about the airbenders.",3,1
Aang, What about 'em?,3,1
Katara," They killed my mother, and they could have done the same to your people.",3,1
Aang," Just because no one has seen an airbender, doesn't mean the Fire Nation killed them all. They probably escaped!",3,1
Katara, I know it's hard to accept.,3,1
Aang," Right, Appa?",3,1
Aang,Yip yip!,3,1
Aang, There it is. The Southern Air Temple.,3,1
Katara,"Aang, it's amazing!",3,1
Aang,,3,1
Zhao,"... And by the year's end, the Earth Kingdom capital will be under our rule.  The Fire Lord will finally claim victory in this war.",3,1
Zuko," If my father thinks the rest of the world will follow him willingly, then he is a fool!",3,1
Zhao," Two years at sea have done little to temper your tongue. So, how is your search for the Avatar going?",3,1
Iroh,"Eh.. My fault, entirely.",3,1
Zuko, We haven't found him yet.,3,1
Zhao,Did you really expect to? The Avatar  died  a hundred years ago.  Unless you have found some evidence that the Avatar is alive?,3,1
Zuko, Nothing.,3,1
Zhao," If you have an  ounce  of loyalty left, you'll tell me what you found.",3,1
Zuko,"I haven't found  Come on, Uncle, we're going.",3,1
Soldier,"Commander Zhao, we interrogated the crew as you instructed. They confirmed Prince Zuko had the Avatar in custody,  but let him escape.",3,1
Zhao," how,  exactly  , was your ship damaged?",3,1
Sokka,So where do I get something to eat?,3,1
Katara," You're lucky enough to be one of the  first  outsiders to  ever  visit an airbender temple, and all you can think about is food?",3,1
Sokka,"I'm just a simple guy, with simple needs.",3,1
Aang,,3,1
Katara,What's wrong?,3,1
Aang, I can't believe how much things have changed.,3,1
Sokka," So uh, this airball game. How do you play?",3,1
Aang," Sokka, zero!",3,1
Sokka," Katara, check this out.",3,1
Katara,Fire Nation.,3,1
Sokka,We should tell him.,3,1
Katara, Aang! There's something you need to see.,3,1
Aang, Okay!,3,1
Aang, What is it?,3,1
Katara, Uh ... Just a new waterbending move I learned.,3,1
Aang,"Nice one! But enough practicing,  we have a whole temple to see!",3,1
Sokka," You know, you can't protect him forever.",3,1
Sokka," Katara, firebenders were here. You can't pretend they weren't.",3,1
Katara,"I can for Aang's sake. If he finds out that the Fire Nation invaded his home, he'll be devastated.",3,1
Aang, I want you to meet somebody!,3,1
Sokka,Who's that?,3,1
Aang, He taught me everything I know.,3,1
Gyatso,"But the true secret, is in the gooey center.",3,1
Aang, Hmm ...,3,1
Gyatso," My ancient cake-making technique isn't the only thing on your mind, is it, Aang?",3,1
Aang," This whole Avatar thing, m-maybe the monks made a mistake.",3,1
Gyatso,"The only mistake they made was telling you before you turned sixteen, but we can't concern ourselves with what was. We must act on what is.",3,1
Aang, But Gyatso? How do I know if I'm ready for this?,3,1
Gyatso," Your questions will be answered when you're old enough to enter the air temple sanctuary. Inside, you will meet someone who will guide you on your journey.",3,1
Aang, Who is it?,3,1
Gyatso, or not?,3,1
Aang, All right.,3,1
Gyatso,One.  Two. Three!,3,1
Gyatso, my young pupil.,3,1
Katara, You must miss him.,3,1
Aang,,3,1
Katara, Where are you going?,3,1
Aang, The air temple sanctuary. There's someone I'm ready to meet.,3,1
Katara,"But Aang, no one could have survived in there for a hundred years.",3,1
Aang, I survived in the iceberg for that long.,3,1
Katara, Good point.,3,1
Aang," Katara, whoever's in there might help figure out this Avatar thing!",3,1
Sokka, cured meats!,3,1
Sokka,I don't suppose you have a key?,3,1
Aang," The key, Sokka, is airbending.",3,1
Aang, Anyone home?,3,1
Zhao,So a twelve-year-old boy bested you and your firebenders.  You're more pathetic than I thought.,3,1
Zuko," I underestimated him  once  , but it will  not  happen again!",3,1
Zhao," No, it will not. Because you won't have a second chance.",3,1
Zuko, I've been hunting the Avatar for two years and I -,3,1
Zhao, Capturing the Avatar is too important to leave in a teenager's hands. He's mine now.,3,1
Zhao,Keep them here.,3,1
Iroh," More tea, please.",3,1
Sokka, Statues? That's it? Where's the meat?,3,1
Katara,Who are all these people?,3,1
Aang, That one's an airbender.,3,1
Katara," air, water, earth and fire.",3,1
Aang,That's the Avatar Cycle.,3,1
Katara," Of course. They're Avatars. All these people are your past lives, Aang.",3,1
Aang,Wow! There are so many!,3,1
Sokka," Katara, you really believe in that stuff?",3,1
Katara,"It's true.  When the Avatar dies, he's reincarnated into the next nation in the cycle.",3,1
Katara,Aang! Snap out of it!,3,1
Aang, Huh?,3,1
Katara, Who is that?,3,1
Aang,"That's Avatar Roku, the Avatar before me.",3,1
Sokka,You were a firebender? No wonder I didn't trust you when we first met.,3,1
Katara, There's no writing. How do you know his name?,3,1
Aang,I'm not sure. I just know it somehow.,3,1
Sokka, You just couldn't get any weirder.,3,1
Sokka, Firebender. Nobody make a sound.,3,1
Katara, You're making a sound!,3,1
Aang and Sokka, Shhhh!,3,1
Sokka, That firebender won't know what hit him.,3,1
Aang, Lemur!,3,1
Sokka, Dinner!,3,1
Aang, Don't listen to him. You're going to be my new pet.,3,1
Sokka, Not if I get him first!,3,1
Aang,Wait! Come back!,3,1
Sokka,I want to eat you!,3,1
Sokka,Hey! No fair!,3,1
Zhao,"My search party is ready. Once I'm out to sea,  you'll be free to go.",3,1
Zuko, Why? Are you worried I'm going to try and stop you?,3,1
Zhao, You? Stop me? Impossible.,3,1
Zuko," Don't underestimate me, Zhao! I will capture the Avatar before you!",3,1
Iroh," Prince Zuko, that's enough.",3,1
Zhao," You can't compete with me. I have hundreds of war ships under my command and you? You're just a banished prince. No home, no allies. Your own father doesn't even want you.",3,1
Zuko," You're wrong! Once I deliver the Avatar to my father, he will welcome me home with honor, and restore my rightful place on the throne!",3,1
Zhao," If your father really wanted you home, he would have let you return by now, Avatar or no Avatar. But in his eyes you are a failure and a disgrace to the Fire Nation.",3,1
Zuko, That's not true.,3,1
Zhao,You have the scar to prove it.,3,1
Zuko, Maybe you'd like one to match!,3,1
Zhao, Is that a challenge?,3,1
Zuko,An Agni Kai. At sunset.,3,1
Zhao,Very well.  I guess your uncle will do.,3,1
Iroh," Prince Zuko, have you forgotten what happened last time you dueled a master?",3,1
Zuko, I will never forget.,3,1
Aang," Come on out, little lemur! That hungry guy won't bother you anymore.",3,1
Aang, Firebenders? They were here?,3,1
Aang, Gyatso.,3,1
Sokka," Come on, Aang. Everything will be all right. Let's get out of here.",3,1
Katara, Aang!,3,1
Fire Sage,Send word to the Fire Lord immediately! The Avatar has returned!,3,1
Sokka, Aang! Come on! Snap out of it!,3,1
Sokka,Aaaaahh!,3,1
Katara, What happened?,3,1
Sokka, He found out firebenders killed Gyatso!,3,1
Katara,Oh no! It's his Avatar Spirit! ,3,1
Sokka," Well, do it! Before he blows us off the mountain!",3,1
Iroh,"Remember your firebending basics,  Prince Zuko. They are your greatest weapons.",3,1
Zuko, I refuse to let him win.,3,1
Zhao, This will be over quickly.,3,1
Iroh,"Basics, Zuko!  Break his root!",3,1
Zhao, Do it!,3,1
Zhao,That's it? Your father raised a coward.,3,1
Zuko," Next time you get in my way, I promise, I won't hold back.",3,1
Iroh,"No, Prince Zuko. Do not taint your victory.  Thanks again for the tea. It was delicious.",3,1
